kWLNZzuo3do_251_260, a woman is cooking shrimp, a chef is frying some shrimp / a woman is frying shrimp / a woman is stirring grabs in a pot / the lady took out the fried shrimp from the hot / a woman fries shrimp / a woman is frying shrimps / a woman is frying shrimp / a woman is removing shrimp from a frying pan / a woman removes seafood from a pot of hot oil / a man cooking his kichen / a woman is frying meat / after deep frying two shrimps coated with batter / a person is frying food / someone is putting shrimp onto a / women making deep frying fishes / a woman is removing fried shrimp from cooking oil with / someone is frying something / a woman puts some cooked seafood on a tray / the woman is frying shrimp / a woman is removing shrimp from a pot of oil / the lady fried shrimp in the oil / a person making noodle / someone is preparing something / anyone is frying / a person is frying food / a woman removes some shrimp from a pan / the person is cooking / food is taken out of a liquid / the woman is frying shrimp / a person is placing shrimp on a grill
onW5hJXnI5s_10_16, a man is riding a horse, a horse is jumping hurdles / a young man riding a horse / the girl is riding / someone is riding a horse as it makes a jump / someone is riding a horse and jumping hurdles / a horse is jumping over a fence / a woman is riding a horse / a woman jumps over hurdles with a horse / someone is riding a horse / a man riding a horse jumps several hurdles / the horse and rider are going through an obstacle course / a person is riding a horse on a ground as / a horseback rider an obstacle course / a men racing on horse / the horse and rider jumped over hurdles / horse backing races / a man is riding a horse / a man riding the horse / a jockey is riding a horse through an obstacle course / a man is riding a horse / a man is riding horse and jumping over obstacles / the man on his horse jumped over the hurdle / a woman riding a horse jumps over a bar / a person is riding a horse / a man is jumping a horse / a man is riding and jumping a horse / a horse and rider are running a fence jumping course / a person on a horse is jumping hurdles
muI1BFsdbdo_33_45, men are running, the men are in a running race / racers are running down a track / a man is sprinting well ahead of the others in / the racers toward the finish line / some runners are running in race / runners is running in the race / men are running a race / a person is the running race / all guys running in running rice / the racers ran on the track / a group of players in running competition / men are running / a of an athlete / men are running in the race / several runners are racing / athletes are competing in meter race / men are running in a race / men are running / men are racing around a track / the men are running a race / the men are running / shot of a race in which the a / a group of men race down a track / men run a race / boys are running / men are racing / a group of men are running / players participating in an race / a group of men are racing on a track / a group of men run a race / the men are in a running race / several men are running on racing track
uAaWVeaYLdQ_1_12, a man is dancing, a man is doing martial arts stunt / the man did a jump in the air / a man leaps into the air and kicks one foot / a man is doing karate / a man is running and jumping on stage / a man is performing martial arts / a man jumps and kicks in the air / a man does a flying kick / a man does a jumping high kick / a man is jumping in the air / a men is presenting the show / a man jumping up high in a wall / the man did jumps in his routine / a man is kicking his leg in the air / a boy is doing fighting stunt / a man is jumping into the air and kicking / the man did moves / a man did a spinning jump kick / a man demonstrates a kicking move / a man is doing a / a person is performing / a boy is jumping in the air / a guy is performing karate / man performing and jumping / a man leaps up into the air and turns with / a person is showing karate stunts / the man did spins in his martial arts routine / a man performs a high jump stunt / a man is jumping and turning in / a man is showing an event / a man is jumping / a person jumping / a martial artist demonstrates a super high kick / a man does a spinning kick in the air / a man jumps in the air and does a / the man is kicking up in the air
lcu-DwrnYY8_2_5, a man is jumping into the water, a man is doing a back flip into a pool / a young man does a double back flip into a / mens are swimming in the pool / the boy is jumping off the diving board / a swimmer preparing to dive in a pool / a man is diving backwards from a diving board / the man jumped into the pool / swimming in the pool / a man is diving off a swimming board / a guy is doing a double back flip off the / the man did a backwards somersault into the pool from / a man is diving / a man jumps off a diving board into a pool / the boy did backwards off the diving board / a man does a backflip off a diving board / a boy is diving backwards from a diving board / a man does a triple backwards somersault off of a / a man is doing a back flip off of a / a kid diving backwards off a diving board / a man dives into a pool / a man is jumping off a low diving board and / a man off a diving board into a pool / a man is diving off a diving board / a man is jumping in / a man is making an backward dive into a / the man into the pool / the man off the board into the pool / good jump diving / the boy did backward from the diving board into / a man does a back flip off a diving board / a man is doing free style jump / one person jumping into swimming pool / a boy does a flip into a pool / a man is jumping in the water / a man made a in the pool / men do flips from diving boards into a pool / a boy does a back flip off a diving board / a boy does a back flip into the pool / a man is diving free style / a man is diving in the swimming pool / a man jumps off a diving board does and / a person dives from a diving board into a pool / a guy is jumping into the swimming pool / a man is doing a backwards off a diving / a man dives into a pool / a man is jump diving in the pool / a man does a back flip from a diving board / a boy does a backflip into the pool / a man is diving inside the swimming pool / a man jumps off a diving board / a man is diving into a swimming pool
xaPepCVepCg_35_46, a rhino is walking, a tortoise is crawling the dirt / a tortoise is walking downhill / the tortoise down the path / the very big tortoise is moving very slowly / a tortoise is moving slowly / funny talking animals / a turtle is walking across the sand / a tortoise is walking along the / a tortoise walking / a turtle is walking / a turtle is walking slowly / the turtle is moving slowly / a tortoise is walking / a tortoise is walking downhill / the tortoise is slowly walking / the turtle moved down the dirt path / the tortoise down the dirt path / a turtle is walking slowly in the dirt / a turtle is slowly walking / a tortoise is walking / a tortoise is going somewhere / a tortoise walks slowly / a turtle is walking / a turtle is walking / a turtle is walking / the tortoise is walking / a turtle is walking / a giant tortoise along / a animal is shouting / a large tortoise is walking downhill / a tortoise is slowly moving across the sand / a huge turtle walking on / the wild animals are talking with them in forest / a turtle is walking / a turtle is walking
lB1UPJ4leqs_0_6, a man is sleeping, the girl woke up / the girl is wake up / a kid is getting up out of bed / a girl waking up / a little girl is laying in bed / a girl gets up out of bed / a little girl is waking up / a girl wakes up from bed / a girl is waking from sleep / the little girl woke up from her nap / a little girl getting up from bed and wearing socks / the little girl woke up from her nap / a girl is waking up in bed / a girl starts getting out of bed / a child is laying in bed / thats an advertisement should be like there is no / the little girl woke up in her bed / the baby is wake up them / a little girl wakes up in a big bed / a little girl wakes up in bed / a girl from sleep / a child wakes up / a little girl is waking up in bed / the girl woke up
hJFBXHtxKIc_118_123, the person is cooking the something, someone pours oil from a bottle into a saucepan / the person is cooking the something / the man is pouring oil into the pot / a man is speaking something / a man is pouring olive oil into a pan / someone is pouring oil into a pot / a man is adding oil to a pan / someone is putting oil into a pan / a person is pouring oil in the pan / a man olive oil to cover the bottom of / someone is pouring olive oil into a pan / a man is adding oil to a pot / a man is pouring oil into a pan / a person is pouring olive oil into a pot on / a person is pouring some oil in the kettle / a man cooking his kichen / the lady poured oil in a pot / there is a preparing the item / a person is pouring oil into a pan on a / someone is pouring oil into a pot / jack is making the sauce / a chef a pan / the lady poured oil in the pot / the man poured oil into the pot / a person is pouring olive oil into a pot on / a person pours cooking oil into a pot / a man is pouring oil into a pan / a person pours oil into a pot / a man is pouring olive oil into a saucepan / a man is oiling a pot / somebody is cooking / a woman is pouring olive oil into a pan / a person pours oil in a pot
o_mWZWcm2r4_47_54, a man is riding a bicycle, a girl is riding a bicycle / the boy is riding the cycle / the boy is bicycle riding / a girl is riding a bicycle / a boy drive his bike / a girl is riding a bike in a parking lot / a girl is riding a bicycle / a girl is driving cycle / a girl is riding her bike in a parking lot / a girl is riding a bike / the girl rode the bicycle / a girl is the cycle / a girl is riding a bike / a girl is riding a bicycle / from television show kids and counting where joy / a girl is riding a bicycle in a parking lot / the persons are cycling / three people watch a girl ride a bicycle in a / a girl is riding a bicycle / a kid playing a bicycle / a girl is riding a bicycle / a girl is riding a bicycle in a parking lot / a girl is riding a bike around a parking lot / the girl is riding a bicycle / a girl is riding a bike / a girl rides a bicycle around a parking while other / a girl is riding a bicycle in a parking lot / a woman rides a bike / a girl is riding a bike / a little girl is riding a bike in a parking
jCplbayVbtw_28_38, a man is walking, a tortoise is walking / a tortoise is walking in a jungle area / a turtle is walking / the tortoise came close to the camera to say / a turtle walks in a setting / the tortoise is moving / a tortoise walking / the tortoise is walking / a turtle is slowly walking towards the camera / a large turtle is walking outdoors / the turtle moved along the ground / a turtle is walking / a turtle walks up to the camera / a tortoise is walking / a tortoise walks slowly / a turtle is walking / a tortoise is walking / tortoise is walking on the ground / the tortoise is walking / a turtle is slowly walking outdoors / a turtle is walking around / a turtle is walking / the walking the tortoise / featuring a tortoise / a turtle is walking / the tortoise came close to the camera / a tortoise walking and raising his head in a forest / a large tortoise is walking / a huge turtle walks toward the camera / a turtle is walking / a turtle is walking / a tortoise is walking through the jungle / a tortoise is walking
mF6ijhSrbBQ_32_40, a cat is playing, an otter is moving over ice / a animal is running / an animal running / the beaver slid on the ice / otter running on the / an animal is playing on snow / an otter is running and sliding on the ice / an otter is running and sleeping again and again / an otter is sliding on ice / the otter is sliding on the ice / an animal is moving on snow / a otter is sliding across ice / an otter slides on the ice / an otter is running and sliding on ice / an otter is sliding across ice / an otter slides on the ice / the otter is walking / a animal jumping / the beaver slid on the ice / an otter is sliding on ice / an otter is sliding across the ice / an otter is sliding on ice / an otter and slides on its stomach / an otter is trying to run on ice / is playing on snow / an otter is sliding on snow / a sea otter slides along some ice / an otter move forward by sliding on snow / an otter ice sliding / an otter is sliding on the ice / an otter runs a few steps then across the / a otter is jumping / an otter is sliding on the ice / a animal is sliding on ice
yfMTsYcLt10_0_7, a man runs into a wall, doing funny / a man runs and jumps on a wall / a kid runs into a wall and falls down / a guy runs into a wall and falls to the / two boys fight and then one boy runs onto the / a young man runs up to a wall and jumps / a man is running into a wall / the guy runs to a wall / a boy is running / a man runs and jumps into a wall / a boy jumped against a wall / a boy runs and throws himself against the wall / someone runs and jumps into a wall / a throwing himself against the wall / a man is running and fallen down on the floor / a kid is jumping a wall / a boy is running and crashes into a wall / a man runs jumps and slams himself against a wall / a guy is running on the wall / a boy jumps into a wall / a boy runs into a wall / a young man ran into a wall and fell on / a boy is talking excitedly to another boy and then / a man runs into a wall / a guy is trying to run into the wall / a boy runs into wall / a guy jumps into a wall / boy runs into the wall / a man is trying to climb on the wall in / a man doing dance / a boy banging himself on the wooden wall / the man himself against the wall / a male runs jumps and slams the front of his / a boy is running fast and hit the wall / a kid runs into a wall / a kid runs and jumps into a wall / a guy runs bounces off a wall and falls down / a man runs jumps his entire body on the / the boy ran and hit the wall and fell / the man threw himself against the wall / a man is jumping into a wall / a boy runs and jumps onto a wall and falls / a boy runs into a wall / a man runs into a wall / boy ran speedily and get hitted with the wall and / a boy give to friend that run on wall / a boy jumped on a wall / a boy run into a wall / a man runs into a wall
fVWUaH2mCt4_1_7, a monkey is pulling a car, a dear steel a mans wife / a man dragged a deer on his back through the / a deer stealing a car / a tries to a person / a deer is jumping over a person / a man and woman are walking and a deer grabs / a deer is trying to climb over lady / the deer is beating the man / is attacking a woman / someone is attacked by a deer / a deer jumps on a womans back / a huge deer grabs a woman and with her / the woman / a deer man wife / a deer tries to a woman / a deer pushes away a women / a is attacking a woman / a man is standing in front of the car / a deer just on a womans shoulder / a deer is attacking a woman / a deer grabs a person and runs off / a deer jumps on a person / two guys playing with a in the snow / a deer is on someones back / a deer a person / a deer attacks a person / a deer is jumping over a womens shoulder / a deer is pushing a woman / a dear climbs on a woman back / a deer running / a deer is trying to jump upon the lady / a deer is on a womans back / a deer an woman / a deer is stealing a mans wife / the man walked with a deer on his back / a deer mans wife / a man is walking in the snow / a deer a person / a deer mans wife / a deer jumps on the back of a woman / a deer is pushing a woman / a deer is attacking someone / a deer jumps on a womans back / someone is attacked by a / a dear is caught a man / the deer jumps on the person / a deer is climbing on to the back of a / a woman standing on snow is pushed ahead by a / a deer a woman / an individual runs across the snow with a deer on / the deer is pushing the person
z9qbQX4J_2g_0_14, the boys are dancing, a group of kids are singing on a stage / a group of children on stage / children are singing / kids are playing / little children singing / a group of school children a speech in / many children are singing together on a stage / a group of children were standing in the class room / many childs are singing / a group of children a onstage / kids are singing on a stage / a group of kids sing on stage / a group of babies are standing in the stage / children are singing in church / children are singing on a stage / all children are singing / a group of children standing in a line are singing / a group of kids take a picture / children are performing onstage / children presenting a group song / young little school children singing a song in front of / children dressed up in colorful clothes standing in a line / children are singing on stage / children are performing some on stage / children were singing on a stage / children sing on stage / kids are onstage / a few kids are singing a song in front of / kids are singing / children are speaking on a stage / children are singing on stage / children are singing on the stage / little kids are something on a stage / a group of small children standing in a row are / a group of young children sing on stage / a group of children are singing / some children are singing something / kids are singing together on the stage / the children are singing / some sing a song / a group of kids singing on stage / a group of children singing a song / a group of children sing onstage / the kids performed on the stage / all kids are singing on the stage / girls and boys are singing / a group of children are singing / a group of kids are singing on a stage / some children are on stage / a group of kid giving their on the stage / children are singing / a group of school children on stage / a group of childrens singing a song on a stage / a group of young children performing together / kids are standing up in a line / the children performed on the stage / a group of school children are performing on stage / children in a line across a stage
lb8J2zCQTlo_3_8, a man is cutting meat, a man is cutting the meat / a person is slicing meat with a knife / a person cutting raw meat / a person is cutting some meat / a man is cutting the meat with a knife / a man is cutting meat / a man is cutting up a piece of meat / using a knife a man chops thin slices from the / a piece of meat is being cut into sections / someone is cutting a piece of meat / a person is slicing strips of meat with a long / a men is cuting the chiken / fat is cut off a section of meat / someone is slicing small pieces of meat off a large / someone is slicing small pieces of meat off of a / a man is slicing the meat / a person is cutting meat / a man cutting some kind of meat for the meal / a man is cutting meat / someone is slicing meet / a person is slicing some meat / a man is cutting a / someone is slicing a large piece of raw meat / the man cutting the big piece of meat into small / someone cutting something with knife / a man is slicing the meat / top layer of a meat is / someone a piece of meat / chopping up meat to prepare a yummy dish / someone sliced off the fat from the meat / a person is cutting meat / a chef slices a slab of meat / a person is cutting meat / a person is cutting meat with a knife / a man is cutting meat / a person is meat / a person is cutting meat / fat is being off meat / the man is showing how to cut a beef / a man trims a big of beef / a chef is cutting a chicken into rounds / the person is cutting / a person is cutting strips off a piece of meat / a man cuting meat / a person cuts a large piece of meat / a man is trimming fat from a roast / a man slices meat / the man is slicing thin strips of beef / is slicing meat / someone is slicing a slab of meat / someone is cutting meat / fat is being cut off of meat / a person is cutting the fat off of a piece
yId1rg5-ac0_40_50, a woman is sleeping, a man is doing something / the girls are them / two women wrestle in their underwear / two women are wrestling with each other / the girls were wrestling / something weird video / the two girls are doing the something / two women are wrestling / the ladies wrestled on the ground / the women are wrestling / two persons fighting / two women are wrestling in their underwear / two women are wrestling on the floor / the women are wrestling / two women are wrestling / two women are wrestling / two women are fighting / the ladies wrestled on the ground / two girls are wrestling / two women are wrestling / women are fighting / two woman are fighting / two women are wrestling / two people wrestle / the persons are beating / two women are wrestling in this black and white video / two women are wrestling / two ladies are fighting / two women are wrestling
tZmDWltBziM_70_80, a man is riding a motorcycle, a man is drinking too much / a man falls down on a city street / the man fell over on the sidewalk / a man leaned against a post and fell down / a drunk man is falling in a street / a man is falling on the road / a drunk man falls on a sidewalk and tries to / its not only drunken driving but also drunken walking is / man fell down on the street / drunken people are the in the world / a man is slowly trying to get up after falling / the drunk people / the man fell on the street / a man falling down in the street / a drunken man fell down on middle of the road / a man is falling down / a man fell on the corner of the street / an man standing on the pavement falls down and / a drunk man falls over into the street / the men fell on the sidewalk / a drunk man falls down in the street / the fell in the road / a drunken man falling on the road / a man fell on the ground / a man and falls down / a man fell down onto the pavement / a man falls on the sidewalk / a series of people who are drunk and trying to / a man is falling over on to the sidewalk / the man leaned against the post and fell down / a drunken man fell down near a road / a man standing on the sidewalk falls down / a man falls down on a sidewalk / a man falls down on the street / the man fell down onto the pavement / a man falls by the street / a man fell on a street corner / a man falls over on the street / after of drinking / a man falls down in the street / a man is falling down / a man is falling down beside the road / a man falls over on the sidewalk / a man is falling down in the street / a man is falling on the sidewalk
zuYZ5kPatJE_78_116, a cat is playing, a ball is kicked by a cat / a cat is pawing a ball towards wood animals / a cat playing with a ball which is coming / a cat is playing / a cat is standing / a cat is playing with a ball and knocking down / a cat plays with a ball / a cat uses a ball to over some / a cat is playing / a cat is / a cat is walking on the floor / a cat is seeing / a cat is playing / a cat rolls a ball / a cat is playing with a ball / a cat knocks some wooden penguins down with a ball / a cat is knocking over blocks with a ball / a cat plays with a little ball and some / a cat is knocking down wooden with a ball / a cat playing with some sort of wooden toys / a cat is turning its head / the cat swung a ball at some standing wooden / a cat knocks over toys with a ball / a cat a small ball then knocking over wooden / a cat is pushing a ball into toys knocking them / a cat doing some funny acts / a cat is playing with a ball / a funny cat playing / a cat is playing / a cat is playing / the cat a wooden ball into the wooden pins / a person is playing with a cat / the cat is playing / a cat is playing with a ball / a cat rolls a ball toward wooden pins / a cat is knocking over wooden with a ball / a ball repeatedly passed to a grey cat is pushed / a cat is playing with a ball / a cat is / a cat is playing / a cat is playing with a ball / a cat is batting a ball away and knocking over / a cat is playing with the ball / a cat is / very fat cat
hW8TKz2Aea4_5_12, the animal is playing, a person is holding a hedgehog / a hedgehog is sitting in a persons hand / a baby hedgehog rides in someones hand / a hedgehog being placed in water / a person is holding a hedgehog / someone is holding an animal / video / someone held a hedgehog in his hand / a person is carrying a rat in his hands / someone is holding a small animal / a man is holding up a small hedgehog in one / someone is holding a hedgehog / a person holding a / the person is holding hedgehog / small rat playing / someone is holding a hedgehog / someone tried to give the hedgehog a bath in the / a man is holding the small animal in his hands / somone is taking a animal in his hand / someone is holding a hedgehog in their hand / someone is holding a small looking animal in their / a person holds a small in one hand / mouse is the / a animal is playing / a rat is a persons hand / the person is holding a hedgehog / a man is showing some animals / a person holds a hedgehog in their hand / a person holds a hedgehog / a person holds a hedgehog in their hand / a boy is holding a hedgehog and puts it in / a bird is so small / a person holds a
