vRC9sBNt9vs_10_16, two animals are fighting, it looks like a really cute walking that / a frog crawls along a mans arm / a man is holding an / a purple frog held by a man in his hands / a man holds a small frog / a man is holding frog in his hands / the man is holding a frog / the man picked up the frog in his hands / thr person is playing with frog / someone holds a toad / a man holds a frog in his hand / the man held a frog in his hand / a man is holding a frog / a man is holding a frog / a man is holding a frog / the man is holding a frog / a man is holding a frog / a man is holding a frog / a small purple frog in hand / a person holds a frog / a man is catching a frog / a man is holding a frog / a man is holding a frog / a man is holding a frog / a man is holding a frog in his hand / a man is holding a small frog / a woman is a frog / a man is holding a frog / the man is in the forest
rXZy-PHtnxg_8_42, a man is standing in a room, a man used a to clean a glass door / a man is wiping glass of a door / a man is cleaning a glass door / a man is cleaning his door with a / window cleaning is very neat / the person is cleaning the window using / a man is cleaning two glass using wet and / a man is cleaning a window / a man is cleaning a glass door / a man is washing the glass in a door / a man is cleaning / a man is cleaning the glass of a door / a man is quickly cleaning / a man is washing / a man is cleaning the / man washing and cleaning door / a man is cleaning a store window / a man cleans a window / a man is cleaning the glass in two / a man is cleaning a glass door / a man demonstrates how to clean glass and / a man is cleaning the of two glass / a man is cleaning a window / a man is washing / a man is cleaning a glass door / man is washing / a man is cleaning / a man is the glass door and wiping it / a man cleans a building glass door / a man is cleaning glass / the man is cleaning the glass / a man is window cleaning / a person is wiping the glass door / a man is cleaning a glass door / a man cleaning the window / a man is cleaning glass / a man is cleaning the into two / a man is cleaning a window / use a wet and a dry roller to clean / a man is cleaning the door glass / a man is cleaning a glass of door / a man is cleaning a window / the man is cleaning the glass / this is way of cleaning a glass door / a man is cleaning a door window / a man is cleaning the glass of the door / a man is cleaning a glass door / a man is cleaning / the man the door / a man is cleaning window glass / a man is cleaning a window / a man is cleaning the glass / a man is cleaning a glass door / a man is washing the door glass of a business / a person is cleaning glass / the man is cleaning the glass / the man is wiping the glass with a / the mand is cleaning the door glass
n_Z0-giaspE_437_447, the boys are dancing, three guys perform a dance routine / three men are doing a presentation / three boys are dancing / boys are dancing in front of people / three men perform for a crowd / three boys are dancing / a young man wearing boxing is by two / men giving some kind of demo of dance and sports / boys are dancing in a class / three boys are dancing in front of a crowd / three men start dancing in front of a class / a group of boys are dancing / the men the boxer / three people dance / guys are performing / three men are performing before an audience / three men are dancing in front of a crowd / a man is standing in front of a room of / the two men did a funny with a boxer / three men fighting / three men are dancing / two guys dancing while the guy in the middle showing / men are dancing / camp / three men are dancing / three boys are dancing in the class room / the men are performing in front of people / three boys are dancing / two men are dancing and one man in the center
lfGlDg47How_93_98, a man is preparing something, the man put a stick of cheese in a bowl / a person is cooking / a man opens a package of cream cheese and drops / a man puts cream cheese in a bowl / a man is dropping a chunk of cream cheese into / a man is taking the butter into a bowl / a man is putting a of cream cheese into / a man is putting a square of cream cheese into / preparing something delicious for the family / the man put a block of cheese into the bowl / a guy puts butter into a bowl / a man is putting cream cheese in a bowl / cream cheese is placed into a bowl to make / a man puts butter in a bowl / a guy is dropping a cream cheese in a bowl / butter is dropped into a bowl / someone a pack of cream cheese and dumps it / a man is putting butter into a bowl / someone is putting butter into a bowl / a man is opening something / a man opens a packet containing a block of cream / a man is opening a package of cream cheese / a man puts a block of cream cheese in a / a man is putting butter into a bowl / a man is opening the butter packet / quick / a man opens a package of cream cheese and places / a man puts a stick of butter in a bowl / the man putting cream cheese into a bowl / a man puts a stick of butter in a bowl / the butter / a man is opening a packet of butter / the man dropped cream cheese into the bowl / a men is doing job / a man is putting cream cheese into a bowl / a man puts cream cheese in a bowl / a person is putting cream cheese in a bowl / a man is putting cream cheese into a bowl / a person adds a stick of butter to a bowl / a cook cream cheese and places it in a / a man is adding butter to a bowl / a man is placing butter in a bowl / a man puts a block of cream cheese into a / put the butter into the bowl / a man putting some kind of butter into a bowl
nTasT5h0LEg_40_43, a baby is crying, a cat rubs up against a baby / a cat is up to a babys face / a cat is rubbing against a baby / a cat is playing with a child / a cat play with a small boy / a black and white cat is rubbing up against a / a cat loving a baby / the cat is the baby / the cat is playing with the baby / the cat with the baby / a cat rubs up against an infant / a cat is rubbing against babys face / the cat with the baby / a cat is a baby / funny cats doing a acts as looks very / a black and white cat sitting next to a small / a cat is petting a baby / a cat is rubbing against a baby / a cat is keeping its mouth on a childs face / a funny cat is trying to from the car / a funny cat playing with little baby / a cat is rubbing up against a baby / the dog licking child / a cat is cuddling a babys face / a cat is playing with a kid / a cat is playing with a baby / a baby playing with a cat / funny things cats will do / a cat is a baby / an white cat is jumping from old car / a cat rubs its head against a baby / a cat rubbing its head against a babys head / a cat is rubbing its face on a small child / a cat is a baby / a is heads with a baby / a cat up with a baby / a cat is playing with a baby / a black and white colored cat is itself against / a baby with a cat / a cat is with a baby / a cat is rubbing against a baby / a cat is with a baby / a cat is rubbing a baby / a cat plays with a baby / a child is playing with the cat / a small boy gaming on the cat / a cat brushes up against a baby / a cat is kissing the baby / a cat is playing with a baby / a cat is rubbing up against a baby / the funny cats / a baby is playing with a cat / a cat is playing / a boy is playing with cats / a cat is a babys head / a cat is hugging a baby / funny cats / a cat rubs up against a baby / a cat is rubbing its face to the baby / baby playing with cat / a cat is rubbing on a baby / a cat is playing with baby / a cat is rubbing its head against a young child
qDjtN7xxNr4_44_51, people are fighting, two men are fighting / men are fighting / men are fighting / they playing a type of play / fighting boys video / two men are fighting outdoors with a crowd looking on / a group of men are fighting / boys are fighting / fighting two boys in a / the men are fighting and pushing each other / a is fighting with group of young guys / the boys fought on the grass / a man is pushing the other man / several men in a group start fighting each other / men are fighting / a group of boys are fighting / boys fight / men drop each other to the ground / boys are fighting / teenage boys get into a match / a fight has broken out / a group of people fight / the men are in a fight / the men are in a fight with each other / fighting scene from a movie / two men are fighting and they get help from two / they are fighting / two men with each other outside / the two boys fighting them / a group of men are fighting / a group of boys are fighting / people are fighting / fighting for / men are fighting / a group of men fight / a group of boys gets into a fight
mHv4iJ9Yr1g_10_16, a puppy is playing with a ball, dog and cat drinking on the milk / a cat is trying to eat while a puppy chews / a dog bites a cats / the puppy is teasing the cat / a puppy is chewing a cats / a puppy is biting a cats / a dog is biting a cats / a puppy is a cats as it tries / the dog bit the cats so that he / a cat is eating out of a bowl and a / a puppy is playing with a cat / the cat is drinking the milk / the puppy bit the cats so that he / a puppy is biting a cats / cute dog and cat are eating food / the puppy bit the cats so that he / a cat is eating while a puppy chews on its / a cat is eating the food and a puppy is / a puppy is biting a cats / a cat is eating from a cup while a puppy / a dog is with a cat trying to get / a puppy is biting a cats / a puppy is chewing on a cats / a dog is chewing on a cats / the puppy is biting the cats / a cat and kitten is eating / a cat is playing / a dog is biting the cats who is drinking
fMXfphSi6Yw_7_12, a man is jumping, a misses her landing on a bar / while performing on a balance beam a girl falls on / a woman fell down while doing / a female performing on balance beam and gets / a guy is performing the / he is can be jumping / a lady is doing / a woman fall while doing / a falling off a balance beam / one person have the circle of pain in accident at / a girl is doing / a is falling on the balance beam / the woman is doing and fell / a girl is doing flips across a balance beam / a girl is doing / a female does a flip then falls / a girl met a serious accident while act / a herself on the balance beam / a girl is jumping on the stick / accident the circle of pain / a accident in the circle of pain / a girl is doing and falling down / a falls on her while using a balance / a is doing back flips then falls / the fell on the balance beam / a person is performing / a girl fall down while performing / a lady has an accident on the balancing bar / a girl falls hard between her legs on the / a girl is doing but an accident / a girl falls on the balance beam / a lands a flip on the balance beam / a girl is falling when she performs / a falls off a balance beam / a girl fall down on bar during game / a girl is doing flips on a balance beam / a girl doing / a woman misses her landing / a girl falls off a balance beam / accident the circle of pain / a takes a on a balancing beam / a woman performing on a narrow beam loses her / a girl showing some amazing movements / a woman is doing / young girls doing get injured on the beam / a girl is doing flips on a bar / a girl is falling while doing / a girl has an accident while doing / a girl met accident in / play game / the girl fell off the balance beam / a does two flips on a balance beam but / the girl met with an accident while doing the / a girl falling on a balance beam
p69d3UBdpR8_98_109, a woman is applying makeup, a woman is applying eye liner / a lady applying eyeliner makeup on her eyes / a girl is getting ready / a girl is putting on eyeliner / a woman applies eye makeup / a woman applies makeup / a woman applying eyeliner / a girl is applying makeup / the girl is putting on eye makeup / a girl puts on makeup / a girl is putting on eyeliner / a young woman is putting on eye makeup / a lady is doing makeup / a girl applies eyeliner / a girl is getting ready / a chinese girl trying some sort of eye and / a girl getting ready / a girl making up her / a girl is using the eyeliner to his eye / a girl is putting on eyeliner / the girl is getting ready / a girl is applying eyeliner / a woman is applying something to her face / a young woman is applying eye liner to her eyelids / a girl is putting on eye makeup / the girl is making up her eyes / a girl is sleeping on the bed / one girl getting ready / the girl applied eye liner / a girl is getting ready to go out / a young asian girl is applying eyeliner / a lady is putting eyeliner on her eyes / a young woman applies eye makeup / a girl puts on mascara / a girl is putting on eye makeup / a girl is putting on makeup / a girl applied eye liner / a woman is putting on eyeliner / a woman is her right upper with eyeliner / a woman is making up eyebrow / some body sleeping / a young woman is applying eyeliner / a teen girl applying eyeliner / the girl is doing make up / a woman applies makeup / a boy getting ready / a girl is putting makeup on / a woman is applying cosmetics to her eyes / a girl is applying eye makeup / a girl is applying eyeliner on herself / girl putting on eye makeup / a young girl putting on makeup / a girl getting dressed / a girl is putting on makeup / a women getting ready by putting make up / a girl is putting on eyeliner / a girls is putting on her makeup / a girl is applying eye liner / a woman is applying eyeliner
oRBgVOiZVsc_16_22, a man is playing a guitar, a girl is playing a guitar / a girl is playing a guitar / a girl is playing guitar / a girl plays a guitar / a girl is playing music / a girl is sitting on a sofa playing an acoustic / a girl is playing a guitar / a woman is playing a guitar / a woman is playing guitar and singing / a woman plays the guitar / a girl is playing instrument / a woman is sitting on a couch playing a guitar / a women is playing guttier / the girl is singing and playing the guitar / a girl is singing and playing guitar / a woman plays the acoustic guitar and sings / the woman is singing and playing the guitar / a girl is playing the guitar and singing / a girl is playing guitar / a girl is playing acoustic guitar and singing / a girl is singing and playing the guitar / a singing woman is playing the guitar / a young girl singing and playing guitar / a girl is singing and playing a guitar / a girl is singing while playing guitar / a girl sings and plays guitar / a girl playing guitar / a young woman is playing a guitar and singing / a girl is playing a guitar / the girl sat on her couch sang and played the / the girl sang and played the guitar / the girl using the music instrument / a girl playing guitar and singing song / a girl sings and plays a guitar / a young girl is playing a guitar and singing
otvx5OZHTJc_1_22, a man is cutting an onion, a person is cutting a fish with knife / fish ready to be cleaned / a man is cutting a fish / a man a fish / the man is cleaning a fish / cutting and cleaning a live fish / a man is is cutting fish / a guy is gutting a fish / a man is gutting a fish that is still / a man is cleaning the fish / a man is cutting the fish with the knife / a live fish is open and with a / a man is cleaning a fish / a fish is being killed / a man is slicing open a fish and cuts off / a man is cutting a fish / a man is cleaning a fish / a man is gutting a fish and then he cuts / a person is gutting a fish / a man is cutting live fish / someone cut open a fish / a man gutting a live fish / a man cutting a fish / a fish is on the floor / a man cutting a fish inorder to prepare it for / cleaning a live fish by it and cutting off / a man cleaning the fish / a man is cleaning a fish / a man cutting the fish to cook it / a man and a fish with a knife / a man is gutting a fish / the man and cleaned the live fish / a man cleans a fish / a man is gutting a fish / a small fish is being cut open / a man is killing a fish / a person and a live fish with a / the cook clean the fish to cook / a man a live fish / a person is cutting a fish open with a knife / the guy is cutting the fish / a man is cleaning the fish / a person is cutting open a fish / a man is cutting a fish / a fish is sliced and / a man is cutting a fish / a man is cleaning fish / a man is cutting a fish / a man is cutting fish / the person is cutting the fish / a fish is being / a men the fish / a man is cleaning a fish with a knife / a man is cutting up a fish / a man open a fish / a person is cutting a fish / a man is cleaning a fish / a man cleaning fish with knife / a man cuts into a live fish / a man is cutting a fish / a man slits the body of a fish on the
kzyFBlNRohs_82_88, a man is playing a guitar, a boy is playing the guitar / a boy is playing a guitar / a boy is playing a guitar / a man playing guitar / a boy is sitting on a couch playing an acoustic / a boy is playing a guitar / the little boy is playing the guitar / a girl is palying guitar / a boy is playing the guitar / a boy is playing a guitar / a boy is playing a guitar / boy playing gitter / the boy played his guitar / a woman plays the guitar / a boys is playing gitur / a girl is playing guitar / a man is playing the guitar / the boy played the guitar / a kid is playing a guitar / a teenager plays a guitar / the boy is playing the guitar / the girl played the guitar / a boy is playing guitar / a boy playing music / a boy is playing a guitar / someone is playing guitar / a boy is playing a guitar / someone is playing an acoustic guitar / a woman is playing guitar / someone is playing a guitar
ficwZQYmRLE_5_20, a dog is playing, a dog playing with a bird / the dog sniffed the / a curious dog is sniffing and poking his nose around / the dogs thinking chicken breast dog is a very / a large white dog sniffs a small yellow duck who / the dog is playing with the duck / a dog is sniffing a / a dog is sniffing a baby duck / the dog is smelling the duck / a dog and a baby duck one another / a dog is sniffing a baby duck / a dog is sniffing a duck / a dog and a duck are together / a dog is playing / a dog is looking at a / a is smelling a duck / a dog plays with a duck / a dog and a baby duck are checking each other / dog and duck are playing / a dog is smelling a duck / the duck is playing with the dog / a dog is see a duck / a baby duck is playing with a dog / a dog is sniffing a / a dog comes close to a duck and sniffs as / the dog and checked each other out / a dog is sniffing a baby duck / a dog is sniffing a duck
fvBs0xpEZhQ_10_30, a man is running, a man is playing with ball / a man passing a ball back forth with his feet / a man is in an office and a small / a man is playing with a ball / a man is playing with ball / a man is playing with a sack in a / the person is playing with the egg / a man showing his football tricks with a small ball / a man is doing sack tricks / a man is playing sack in the office / a man is tossing a ball with his legs and / in an office a worker plays soccer with a piece / a man is playing with a ball in a office / a man is tossing a ball with his feet / a guy is playing / a man is playing with a sack / a man is playing is kicking a piece of paper / dont they select me to soccer team / a person is playing with the ball / a man plays with a sack inside an office / a man plays with a in an office / a man is playing with ball in office / in man is doing tricks with a sack in / a man does balancing tricks with a ball / the man played in the office / a man is playing with a sack in an / a man is doing things / a man is playing with a sack in the / a man is playing a ball in the office / a man plays in an office / funny catch / a man is kicking around a foot bag / a guy is playing / a man is playing in an office / a man dancing / a man playing with a ball inside his office / the man is playing with a ball / a man is playing in his office / a person is playing with the ball / a man is kicking a paper ball / in the office the man wants to him with / the man is playing with a ball in the office / the man played in the office / a man is playing sack in an office
gqxpGOHUH9k_113_119, people are dancing, some people are dancing / the people are dancing / a of movie / a group of people are dancing / many people are doing a dance / a crowd of people are dancing in the street / the cast did a dance outside / people are dancing in a village / the dancing / people dancing in joy / the people are dancing / people are dancing / many people dance in the street / men and women are dancing / people are dancing outside / the people are dancing in the town / the danced in the street / i like this video / a large group of men and women are dancing together / all people are dancing / several people are dancing in the street / a large group of people dance in a street / a group of people are dancing / many men and women are dancing in the street / people are dancing outside / people are dancing in the desert / a group of people are dancing / people are dancing / the people danced in the village streets
kquB3rIgfGk_640_645, a man is eating, a man is drinking water / a man is drinking water from a glass / a man drinks a glass of water / jack is show how to prepare the food / a man drinks a glass of water / a man is taking a drink / a man drinks from a glass / the man is drinking a glass of water / a man drinks from a glass / a man is drinking / a man is drinking water / a man is drinking a clear liquid from a glass / the man is drinking something / we have of the cucumber water but we / a man is drinking a drink / a lazy man drinks water from the glass / a man is drinking / a man is drinking a glass of clear liquid / a man drinking the water / super making for lazy mans drinking video / a man is drinking cucumber water / a man drinking water / a chef takes a drink of his / a man drinks something / a man is drinking from a glass / a man drinks water / the man drank a class of water / a man drinks out of a glass / a person is drinking / a man is drinking a glass of water / the man is drinking cucumber water / a man is drinking a cup of water / the man is drinking water / the person is making omelet / a man is drinking something / a man pouring a fruit juice / a man is drinking water / man having a glass of water / a man pours and drinks a glass of water with / a man standing in the kitchen drinks cold cucumber water / a fat men drinking the water / a man coking / the man drank a glass of water / a man is drinking water from the glass / a man is drinking from a glass / the man took a of water / a man is drinking something out of a glass
klFyrnrUSck_63_73, a man cooking his kichen, the person is preparing the something / a woman is coating pieces of pork with flour / the lady brushed flour on the meat / the woman is breading pork chop / a lady is showing demo for making / a woman is coating a pork chop in flour / a woman is coating a pork with flour / the lady floured the meat and dipped it in egg / a woman some meat / how to make / a woman a slice of pork meat on both / a woman covers a piece of meat with flour / a woman is flouring a pork chop / a woman is brushing flour onto meat / a cook is applying flour to a pork steak / a japanees woman applying somekind of powder on a slice / the woman is pork chops / a woman is putting flower on meat / a woman is coating a pork with flour / a woman is breading some meat / a woman is brushing flour on a piece of pork / how to make / a woman is covering some pork with flour / a woman a pork chop with flour / someone is breading a pork chop / somebody is baking / a woman is preparing meat / a woman is seasoning a piece of meat / a woman is putting flour on meat / a person brushes flour on a pork chop / a woman a piece of meat / making / she is cooking / a woman is coating a meat cutlet with flour / a woman puts a piece of meat on a plate / a woman is spreading some flour on a meat / someone making a dish in the kitchen
klFyrnrUSck_79_85, a man cooking his kichen, someone is preparing pork for cooking / a woman seasons raw meat / anyone is making dish / a woman is breading a piece of pork / someone is breading a chop / a woman is spreading some breadcrumbs on pork / a person is cooking / someone is breading meat / someone is breading a piece of meat / a person is coating pork with bread crumbs / the lady dipped the meat in egg and flour / a woman is coating a pork chop / a man coking / someone is breading meat / a video on how to make / a steak is dipped in egg and then covered with / a person is breading pork chops / a person is cooking / someone dips a pork chop into raw egg and then / somebody is something with meat / a chef a piece of meat / the woman is a pork chop / a person is seasoning a piece of meat / a woman is preparing some dish / someone making a dish in the kitchen / a woman is breading meat / man showing how to fry meat in egg and breadcrumbs / the lady dipped the meat in eggs and bread crumbs / a woman a slab of pork meat in bread / a woman is breading a pork chop / a woman is putting meat on a tray / a woman rubs powder on a cut of meat / a person breads a piece of meat / a man cooking his kichen / a man is covering meat with flour / a man is teaching how to make pork / a person making dish / a woman transfers some meat from a bowl to a / a person is coating a pork chop with breadcrumbs / someone a pork chop with egg then it / a women making the / a woman is breading a pork chop / how to make video / a man is preparing food / the person is cooking
