tPkZK-PzeQE_10_28, a man is slicing a tomato, a watermelon is being sliced / a person is slicing a water melon / a man cutting the watermelon / someone is slicing with a machete / the hand is slicing a watermelon / a person cutting watermelon / using only one hand a watermelon section is cut into / an individual is slicing a watermelon / a watermelon gets sliced / a person is cutting watermelon / watermelon is being sliced / a person slicing a watermelon / the water melon is being cut into three parts with / a water melon is being sliced / a water melon is shown being sliced with a large / watermelon is being sliced with a large knife / water melon being diced into slices before serving / someone is cutting the water melon / a person is cutting watermelon / someone is cutting up watermelon / a person slices watermelon / a woman is slicing watermelon / watermelon being sliced / a person cutting watermelon / a person cuts watermelon with a knife / in video is been cut in the pieces / in the video the watermelon is being cut into pieces / a man cuts through melon with a knife / a person is slicing watermelon / a man is slicing watermelon / a big piece of watermelon is being cut into smaller / its a video the water is being cut with / someone is slicing a watermelon with a cleaver / someone uses a large knife to cut a watermelon / a watermelon is being sliced with a cleaver / someone is slicing pieces of watermelon into smaller pieces / someone is slicing watermelon / sliced fruit / a person is cutting watermelon into pieces
zr9OeyfLPPY_4_9, the person is cooking, plastic toys are floating in water / a toy fish is swimming / the toys are in the tub / a woman is bathing in / a fish is swiming / the person is cooking / a lady is bathing / a girl with black lipstick on is laying in a / a toy fish is swimming / a woman is dead in a bathtub / the tub toys moved toward the girls head in the / toys are floating in red water / toys are moving in a tub / toys are moving in a bathtub / a toy shark is swimming in a bathtub / toys are in a tub of water / two electric toys are swimming in red water in a / a toy shark swims in a bathtub full of red / toys are swimming in a bath of red liquid / she take both / toys are floating in a bathtub / the toys are in the tub / a fish is swimming / a woman in bath tub with / a woman in a pool of / a toy fish is running on red water / a person is / the lady take bath the doll and fish other toys / the bath toys swam in the red water / the play and shark swam in the red / a toy fish is swimming in the water / bath toys are swimming / a shark and human toy are moving through a tub / a woman is taking a bath with toys / master the / are killing a woman in a bathtub / the women is bathing / the toys are moving in the water / a young woman with dark lipstick on sitting a / a fish swims in water / a toy fish is moving in water
kEGmZDpZ_RE_248_293, a man cooking his kichen, a woman chops up some herbs / a person cabbage / a woman is chopping herbs / a lady preparing some sort of items for making chicken / a person dices a leafy green vegetable / a woman is cutting up fresh herbs / a man is chopping leaves / someone chops herbs / a woman is mincing herbs / the woman is finely dicing vegetables / a woman is slicing food / a guy is preparing the chicken curry / a woman is chopping an / a woman cooking her kichen / woman is cutting vegetable leaves / the lady is showing how to make easy chicken curry / a woman is chopping vegetables / a person cutting vegetables / a person is chopping a green vegetable with a knife / the person is showing how to make chicken curry / an illustration on cooking / a man is slicing some / fine chopping of / a woman is dicing herbs / a man is cutting the coriander leaves / a person chicken curry / a chef chops herbs / a woman chops herbs / a man is cutting the leaves / the lady chopped up the leafy spice / a woman is chopping leaves / someone is slicing herbs / a person is chopping herbs / a woman is cutting coriander leaves / a person is chopping herbs / a woman is chopping herbs / a man making chicken curry / a woman is mincing fresh herbs which is to be / a man is cutting spicy leaves / the lady cut up the / an easy way to make chicken curry / a man is slicing chicken curry / a woman is chopping up herbs / a woman is finely chopping a bunch of fresh herbs / someone is cutting green leaves / herbs are being chopped / the person is cutting vegetables / someone is finely chopping up a green leafy substance
xCFCXzDUGjY_5_9, a man is jumping, a guy is falling off a skateboard / a man fell on his skateboard / a man is skating / a man skateboards up a wall and falls / a skateboarder crashes to the ground / the man fell off his skateboard / a man performs at the event / one person some skin for / a boy is skating / a man is skateboarding and fell down / a skateboarder comes down crashing his head / a man falls while skateboarding / skate some skin / the skateboard is doing tricks and then fell / the skateboarder fell off his skateboard / a guy is riding a skateboard on a ramp and / a falls down / a gets while trying a stunt / a man skating on road / a person fell down while skating / a young man crashes and falls while skateboarding / a skateboarder misses his landing and crashes / a man is skating / a man is doing stunts / a man is falling when he performs skating stunts / a boy performing some dangerous stunts on a skate stadium / skating and falls scraping his side very / a skateboarder falls off of his skateboard while performing stunts / a man skates a tunnel then falls / a guy fell off his skateboard / a man is riding a skateboard / skate some skin to the / a man with a on his back rides / the person is sliding / skate some skin he is skate / the skateboarder fell off the skateboard / a man is skateboarding and falls / a guy himself from falling off his skateboard / a man met an accident / peter is playing skating / a man falls of his skateboard / a skateboarder is falling while trying to perform tricks / a young man falls from his skateboard while performing a / a man is skateboarding on a and falls off / some skin to the / a man showing tricks of skates / someone is doing skateboard stunts / a guy is on the ground / a man is skateboarding
lc9bA-hvqHU_1_6, a man is running, a man a ball which hits the only / the boy is playing the shot / a knocks down three pins in two / a man is / a man is playing / a man is / the man was flying / a man is making a shot / the boy is playing / a hits two on two sides with one / a man is playing / a person is at a / a man is playing / a man is a double in two / a man is / a man is playing / a man scores a in / shot is done by a person / a man knocks three pins on two with one / a man performs a trick shot / a man bowls a / a man is rolling a ball into the two / the man hit three pins / the man hit the split pins with the ball / a man is at a / a man is throwing a ball down a lane / a man is a / a man taking a shot on two left bottles / the man and hit two pins / a man is playing shot / they are playing flying shot / a man hit the split pins with his ball / a man does a trick shot / a man hits three pins on two / a man is playing / a player is flying shot / a man does a split in a / a boy throwing ball / a man is throwing a ball / flying shot / a man bowls across two / a throws a trick shot across two / a man playing very well / a man is playing the shot game / a man is a double / in an / a man is / someone is / a in doing a trick shot / a man is / a man makes a flying shot / a boy playing game / a man picks up a in his lane / a man is playing game hits many bottles / the man made an amazing shot / a man is / a guy is playing the / a man is / a man is
lGk1MA6YP-M_36_48, a man is riding a horse, the horse and rider trotted around the ring / a woman is riding a horse inside / a man is riding a horse / a man is rading a horse / a rider is walking her horse inside / a person is riding a horse in an arena / a woman is riding a horse / a horse riding show in a stadium / someone is riding a horse / it is a show / some one riding on horse / a man is riding on the horse / someone is doing horse stadium / a man is riding a horse / a person is riding the horse / a woman rides her horse at walking speed / a boy riding a horse by taking a getup of / a person is riding a horse in a stadium / a woman is riding a horse around in a stadium / a woman is riding a horse in an arena / a girl participating in an show / a jockey rides a horse around an arena / a woman rides a horse for jumping show / a woman is riding a horse / a jockey riding a horse in an indoor stadium / a woman is riding a horse in an arena / a person is riding their horse in an arena / a woman is seated on a horse as it / a girl is riding a horse / a person is riding a horse along a perimeter / a girl is riding a horse / the man is riding a horse / a woman is riding on a horse / a woman riding on the horse in ground / a person is riding a horse / a girl is riding a horse / a girl is riding a horse in a stadium / a woman is riding a horse in a event / in circus horse ride / a person is riding a horse / the man is riding a horse / a lady riding a horse / there is a horse race / someone is riding a horse / the horse and rider performed in a competition / a men walking on horse / a woman is riding a horse / a woman is riding a horse / a girl is riding in the horse / a woman rides a show horse in a stadium / a man is riding on a horse / the woman is riding a horse / a man is riding in a horse / a man is riding on the horse / one man riding on horse / a woman is riding a horse / a man is riding his horse / a show with a
kEGmZDpZ_RE_295_330, a man cooking his kichen, this is how to easy chicken curry / a woman preparing garlic for use / easy way to cook a chicken curry / a person cutting a onions from the field / the lady cut the off the green onions / a woman cuts the and stem of a garlic / a girl is cutting a root / a woman removes off garlic / its a easy method of preparing chicken curry / receipe shows how to make a delicious chicken curry / a person is removing root from garlic / she is cooking / preparing chicken curry / a woman is cutting garlic from plant / the of a dug out garlic plant are / a person removes the root of garlic / a woman is removing garlic from stalks / a woman is cutting and opening a garlic / a woman is cutting a peeling a full garlic / a man puts some raw onions in a bowl / the girl cut the off a / a man make a chicken curry / a woman is removing the and stems from garlic / someone is cutting the root off a plant / garlic is being into a bowl / a man is making the easy chicken curry / someone is doing operation of a new onion / a chef is cutting off a root / a woman is cutting off a vegetable / somebody is cutting garlic / a woman is removing stems of fresh garlic / a man cooking his kichen / the person is doing chicken curry / someone is cleaning what looks like a leek or / a person is taking the off a clove of / a lady is cutting garlic / a woman cleaning a garlic inorder to make chicken curry / a person is cutting the plant to get garlic / one lady trying to cut garlic / the woman is removing the root from the garlic / a woman cutting the of fresh garlic / a man is cutting garlic / a woman is pulling garlic apart / the person is cutting the something / a women cuting chicken curry / a guy is preparing the chicken curry / a woman shows how to clean garlic plant to get / the lady cut off the of a / a woman is cutting and cleaning some garlic
kWLNZzuo3do_206_213, a woman is mixing something, stired in the dry ingredients in the water to / a person is making some food / a woman is mixing flour in a bowl / a woman mixes batter in a bowl / a woman is making batter in a bowl / a woman is mixing flour and water in a bowl / a woman makes batter / a man is mixing an / a woman is adding flour to water / a person is mixing water and flour / the lady added corn meal to the water for a / a woman is adding flour to water / a chef stirs flower with water / a person is mixing powdered ingredients with water / the woman is mixing flour and water / the person is cooking / flour is poured into the water / a person making noodle / a person is pouring a flour into water / a woman mixes flour into a bowl of water / very clear detail for noodle video / a woman pours a substance into a bowl of / a woman is making a flour batter / someone is mixing ingrediants / a woman is saying how to make noodle / a cook mixes up some ingredients / the woman is mixing flour and water / the person is powder is water mixing / a person mixes flour and water in a bowl / a man cooking his kichen / a woman is mixing some ingredients / preparing the item / a person is mixing water and a powder in a / a woman is mixing ingredients / anyone is mixing in water / the lady added the dry ingredients to the water for / a woman mixes flour and water in a bowl
uppFvcVwqqY_5_15, a man is playing a piano, a man plays the piano with his nose / the man played the keyboard with his nose / a man plays the keyboard with his nose / an amazing clip of an old man playing piano with / a man is playing a piano with his head / an old man plays a keyboard with his nose / a man is playing the piano with his nose / a man playing piano / a man is playing the piano with his nose / a man is playing a keyboard with his nose / an old man is playing piano with nose / a man is playing an electronic keyboard with his nose / the man is playing the piano with his nose / a old man is playing guitar with his mouth / man playing the keyboard with his nose at a baseball / a man plays the keyboards with his nose / an old man is playing the piano with his nose / a man is playing an electronic keyboard with his nose / a old man playing the piano with his head / a man is playing the piano with nose / a man is playing a piano with his nose / a man is playing piano with his nose / an old man is playing a piano with his nose / a man is playing piano with his nose / a man is playing a keyboard with his nose / a man is playing piano with his nose / a man is playing piano with nose / a man playing piano with his nose / a man is playing a piano with his nose / an old man playing piano with his nose / a man is playing with mouth / an elderly man is playing the piano by only using / a man plays a keyboard with his nose / a man is playing the piano with his nose / an elderly man is playing a keyboard with his head / a man is keyboard with his nose / a man plays a piano with his nose / a man is playing a piano with his nose / a man playing piano with his nose / a man is playing piano with his face / a man plays the keyboard with his nose / a man playing piano with his nose / he is playing some instrument / a man plays the piano with his nose / the man is playing the keyboards with his nose / the man played the keyboard with his face / an old man is playing piano with nose / an old man is playing a piano with his face / an old man is using his nose to play a / the man played the keyboard with his nose / an old man sleeping over key board / in over an instrument / a man is playing piano with his nose / the man is using his nose to play the piano / the man played the keyboard with his nose / a man plays piano with his nose / a man is playing the keyboard with his nose
sBjr8UJOpsQ_149_169, two men are dancing, a man and woman dance near / dance in the rain / two people are dancing in front of a / the man and woman are dancing / a man and woman are dancing / a man and woman are dancing in the water / two people are dancing / one couple is dancing / a man and woman are dancing near a / and were dancing / a man and a woman dance in front of a / a man and woman are dancing outside / a young couple singing and dancing / two people are dancing / a hero and the heroine are dancing for the song / hero and are dancing in a song sequence / a man and woman are dancing / the women is playing in the rain / the dancers danced by the / a man and woman are dancing near a / a man and a woman are dancing near a / a man and a woman are dancing / a couple are dancing near a water falls / the couple danced by the / a couple playing in rain / a man and a woman are dancing in front of / a man and a woman dance beside a / the man and woman are dancing / a couple are dancing near a / a couple are dancing / two people are dancing / the couple are dancing / a man and woman dance in front of a / a couple is dancing / a man and a woman is dancing in the water / a man and a woman are dancing in the rain
nCtZFOYAlvQ_44_49, a man is flying a hill, a skier is going downhill / the skier is very / the person is snowboarding down a mountain / a person is snowboarding down a hill / a person skiing down a / the snowboarder down the hill / the snowboarder is riding down the hill / a man is skiing in the ice / peoples are skating over the snow / a men on the ice / a person is snowboarding / a person is snow boarding / a skier down a mountain / a man is skating on snow / a man is enjoying in a cold mountain / the snowboarder down the hill / the man is palying / the snowboarder is going down the hill / a snowboarder is shown snowboarding down a snow covered slope / a person is snowboarding in the snow / a person is doing snow boarding / a man is performing ice scatting / several snow are skiing down a / the canada tourism / a person down a slope / someone is snowboarding down a hill / a man is snowboarding / people snowboarding / someone is snowboarding / someone is snowboarding down a hill / men on the snow area / a man on a huge mountain / a man showing some sort of unique steps of snow / a man is snowboarding down a mountain / a person across the / showing canada tourism / a person is snowboarding downhill / a man skis / a man is snowboarding down a mountain / a man is doing skating on snow road / forest with in the background / a is skating on the ice / a man is performing ice skating / a man is snowboarding / a person is snowboarding down a hill / someone is skiing / a man snowboarding on snow covered / this is canada tourism commercial / a person is skiing down the side of a mountain / the clouds are behind the mountain / someone is skiing / a man skating on ice / the man is snowboarding / a man surfing through the snow / a snowboarder is snowboarding a big mountain / a man is scating in the / someone is snowboarding down a mountain / man down mountain / a beautiful canada / a person down a slope
ibSwITK4jjQ_14_24, a man is driving a car, the police pulled over the car and drew his / the police men is showing the gun in front of / a police points the gun at a white car / a is stopping a car / a police man is someone over on the side / police is checking car / a cop is pulling someone over / a cop is pulling a gun on a person who / a cop is trying to a car driver / the car was parked beside the road / the person is shooting the car / a police is pulling over a car on a / a police pulls a car over / a police pulls a gun on a driver / a police is shooting on the road / an police approaches a stopped vehicle / a police approaches a pulled over vehicle / a approaches a parked car with his gun drawn / police man scaring with other person / covering a car standing on the of an / a police with gun drawn is walking towards a / a police is rounding up a car / a police is / a police holds a gun in the air ready / mad police holding a gun on a driver / an has drawn their gun at a / police / one showing his gun to / a cop is stopping the car / a police man is on car / a is trying to check someone car / a police is pointing his gun at a stopped / the pulled a gun on the driver he pulled / a police / a police is trying to the person in car / a searching a car / a cop pulls a gun on a person in a / a is pointing gun towards passenger / the pulled a gun on the car he had / a police is yelling and pulling a woman from / a police moves toward a car with his gun / driving the car / many cars are running on the road / a police man is shouting and pointing a gun to / a cop is pointing a gun at someone / a police is approaching a vehicle with his pistol / a police pulls out a guns and takes aim / a car is going on the road / a aiming a gun a white car / a man is chasing a car / a pulls a gun on someone / cop is a car
uO7Eysrs8_k_106_114, a man is riding a bike, a man is crashing his bike / love towards heroine / a man wipes out on a motorcycle / a motorbike on wet muddy road / the person is bike riding and / a man is riding on a motorcycle / a man sleeping in the mud with his bike / a boy falling to byk / a man crashes his motorcycle / a man is riding a motorcycle and wipes out / a man fallen down from his bike / a guy is drinking cool drink in the play ground / a man falls off his motorcycle and into mud / a man is riding a motorcycle and he crashes / a man on a motorcycle falls into a pool of / a young indian man is by his girlfriend and / a man is riding a motorcycle and crashes into a / a man falls off his motorcycle and lands in a / a man is riding a motorcycle and then falls into / a man riding a bike and falls in muddy / having a soft drink in an almost empty stadium / a man is crashing his motorcycle into a puddle of / an actor is riding the bike / an bike rider asking he to sit on / a man riding a motor bike than sliding in a / a man crashes his motorcycle / a bike is driven by a man / a man is driving a motorcycle / the man skidded on his motorcycle and fell off / a man crashes a motorcycle in mud / a man riding bike and fell down / a man driving a motorbike and suddenly out in / actor surya fell from a bike / the man slid off his motorcycle / a person stunt on the bike / a man is falling from a motorcycle / a man is riding a motorcycle and crashes in the / a man is riding on bike / a man is riding a motorcycle and loses control / a man crashes on a motorcycle / a biker crashes into a mud puddle / a man fell off a motorcycle / a man crashes a motorcycle / the man skidded and fell off his motorbike / a man crashes on his motorcycle
q9ew_nITQWY_54_62, men are playing cricket, a cricketer is making funny things / several men are playing cricket / men are playing cricket / men are playing cricket / a cricketer are playing cricket / people are playing cricket / people are playing cricket / the boys are playing / two teams are playing cricket / men are playing cricket / some men are playing cricket / the people played a strange game with a bat and / player playing in the ground / people are playing cricket / a hits a ball with a bat / a player is missing the run out / a misses the to make the batsman run / men are playing cricket / men are playing cricket / people are playing cricket / a man in cricket performs an / players playing the cricket / the cricket player hit the ball and ran / men are playing cricket / two teams were playing cricket / a player is / the men are playing cricket / a group of men are playing cricket / two teams are playing cricket / a man is throwing and catching a ball / and india in a match / a cricket pitcher drops the ball / a group of people are playing cricket / two teams are playing a game of cricket / a batter makes a in a cricket match / men are playing cricket / people are playing baseball / the men are playing cricket / men play cricket / peoples are playing cricket / really funny cricket video / can cricket on the stage / two teams are playing cricket / players playing cricket but in a bad manner / two teams play cricket
pdrBPJYfTC8_33_39, a man is preparing something, with animated characters are moving / animated painted onto with one another / an animation cup is running / the cups are rotating / tea cups moving to animation / sesame streets tiny little super guy is playing baseball on / a cup is moving down the table / a cup with a character on it walks accross the / a cup with cartoon is jumping / an animated character on a cup is walking the cup / cartoon people are on cups / its a kids game of little super guy / animated cups are moving on a table / a doll in the cup is dancing / cartoon on cups are playing baseball / the cartoons on tea cups are playing a game / a cartoon on a cup / the cartoon characters on the cups to move / a grey cup with a cartoon picture is on / showing a cartoon / a cartoon person painted on a cup walks his cup / animated coffee move around a table / cups are moving / the cup is moving across the table / cups moving here and there / a cartoon figure on a cup is playing with a / the cartoon people on moved by themselves / a play put on by cups / a cup is walking on table / sesame street little super guy game / cartoons are walking on / cartoon characters on coffee / cups are dancing on a table / an animation shows with people on them walking / several drinking to move by themselves / the cup moving / a table up on the cups / two coffee cups moving with cartoons / sesame street and little super guy game / the cups is game to something / coffee cups are moving across the table / coffee are moving around on the table / the cups are moving / coffee are walking / a cup is moving on the table / cups are moving / cups are moving across a table / cup is moving animation / a drawing is in motion on the cup / the man on the first cup is playing with a
