qRoxNXm7INc_58_66, a cat is playing, the man pet the cat on his head / someone is petting a cat that is laying on its / a person playing with a cat / someone a cats head / a man is playing with a cat / the person is petting the cat / a cat when rubbed / a cat is being petted / someone is petting a cat / someone petting a brown and white cat / a person is petting a cat / a cat is playing / the person is playing with the cat / the person is playing with the cat / a cat / a cat is playing / a person is petting a cat / the cat is being petted / someone is rubbing the head of a cat lying down / a person is petting a cat / someone pet the cat on its head / a person is petting a cat / a cat is getting petted by a person / someone is playing with a cat / a person is playing with cat / a man is pampering the cat
wn9rDTZj-m4_8_18, a woman is playing a violin, a girl is playing gittar / the little girl is playing the violin / the girl played the violin on the beach / a small girl playing the violin / a young girl is playing a violin / a small girl standing on sand is playing the violin / a girl is playing the violin / the girl is playing the violin / a kid is playing violin / a girl is playing a violin / a girl is playing violin / a young girl is playing a violin on the beach / a girl is playing a violin / a little girl plays the violin on a beach / a girl is playing a violin /  / a girl is playing a violin on the beach / a girl is playing the violin / cute girl playing music very well / a girl plays a violin on the beach / a girl is playing a violin / a kid is playing the violin / a girl is playing the violin / a girl is playing violen / a girl plays the violin / a girl plays a violin / a little girl is playing her violin on the beach / a little girl plays an instrument in the sand / the little girl played the violin / the cute baby is playing violin / the girl is playing violin / the girl is play violin / a girl is playing musical instrument / a young girl is playing the violin on a beach / a girl is playing a violin / a little girl is playing a violin / a girl playing violin / a child is playing the music / a girl are singing a song / a girl is playing violin / a girls is playing a violin / a girl plays the violin / a girl is playing the violin
hJFBXHtxKIc_163_168, the person is cooking the something, a person is sprinkling seasonings into a pan of meat / the man seasoned the in the pot / a person is pouring spices into a pot on the / a man is putting the pepper for the hot dog / the man seasoned the in the pot / a cook seasons some sausage / a cook seasons some meat / the man is seasoning / a person seasons / a man seasons meat in a pot / a man is adding some spice to a bowl / a man cooking his kichen / a person is adding seeds in the pot / a pot of sausage is being seasoned / someone is seasoning sausage in a saucepan / a person is adding seasonings to a pot that is / a chef sprinkling spices into a dish / someone is pouring spices into a pot of / a guy teaching how to make sauce / any one is making dish / the person is boiling the something / someone is seasoning food / someone is putting seasonings in a pot of sausage / jack shows how to prepare the food / a man is seasoning meat / the man is seasoning the / a man is sprinkling spices onto in a pan / someone is seasoning sausage in a pot / a person making spaghetti sauce / someone is seasoning some meat
nPj6EcVGoUY_7_15, a dog is playing, the is the dog / a dog is trying to catch a fly / a dog is playing with an ant / a dog is trying to catch the fly / a dog is making fun with a fly / a dog is observing a bug / a dog is pawing a fly / a dog plays with a fly on a carpet / dog playing with a fly / the dog played with a bug on the carpet / a dog is playing with a fly / a dog is trying to catch a fly / a dog is playing with a fly on the floor / a dog trying to hit a fly / a dog is playing with a fly / a dog is playing with a ball / the dog is playing with the fly / a brown dog barks and tries to a / a dog playing with a fly / a dog is playing with a fly / a beagle dog is on the floor watching a fly / a dog is trying to touch a fly / fight with a small creature by dog / a dog catching a / a dog is playing with a fly / and fly playing / a dog is playing with a fly / the dog is playing with / the dog is teasing a fly / a dog bats at a fly / a dog playing with a fly / a dog is trying to catch a fly / a dog plays with a / a dog is playing with a fly on the / a dog is playing with a fly / a dog paws at a fly / a dog playing with a fly / the dog played bug / a dog is playing with a fly / a dog trying to hit the fly / a dog plays with a fly without it / a dog is barking at a fly / a dog is trying to get a fly on the / a dog playing with fly / a dog barks at the fly and it wanted / a dog is trying to scare a fly / a dog is playing / the dog is barking to the fly / a dog is at a bug / a dog is playing with a fly / a dog is barking at a fly / a dog is playing with a fly / a dog is pawing at a fly in the carpet / a dog is playing with an insect / a dog is playing with a fly / a dog play with a / a dog is playing with fly / a dog is playing with a bug
rw9h_574HxE_127_133, a man is running, a man and woman and walking / the man and woman are walking / a boy and girl are walking in garden / a man and woman are walking / a man and a woman are walking together / the couple walked arm in arm down the path / a view of a forest / a man and woman are walking arm in arm through / a man and a woman are walking in the woods / a man and woman are walking in the woods / the couple are walking and hugging / a man and woman are walking together / a man and woman are walking / a man and a girl are walking / a man with his / a man and woman are walking together through the woods / a man and a woman walk through the woods / a man and woman are walking / the couple walked down the path together / a man and a woman are walking in the woods / a man and a woman walk through the woods / a man and woman walking hold each other / a man and a woman are walking along a trail / a men and women walking in forest / a man and a woman are walking / a couple are walking through the woods / a couple is walking through the woods / a couple is walking through the woods / a couple is walking in a park / a woman and a man with their arms around each / a couple is walking in a forest / two people are walking through the woods / the couple walked arm in arm down the path / singing together / a man and woman are walking through a field
j2sOMdilDWU_87_97, the person is cutting the something, a person someones leg / an artist drawing some kind of drawing on paper / someone is drawing / a person is drawing by a pencil / a man is drawing something / someone is drawing a picture / a man is drawing / the man is drawing / the man is drawing / a man is drawing / the man drew on the white paper / a drawing / someone is drawing / a man is drawing a picture / a man drawing on paper / someone draws a human leg / a man is drawing something on a piece of paper / a person is drawing on a piece of paper / the person is drawing the / a man is drawing / the man drew on the pad of paper / a man is making the drawing on the paper sheet / a man is drawing / a man is on a pad / a man is drawing on a paper / it is very the of the i / the man drew on the pad of paper / drawing / the man is drawing with all of his / a man is drawing
uiLr9bdOL0M_23_30, a bird is eating, a bird picks up a cup with its beak / a bird is taking glass / the bird put the cup into the bowl / the bird put the cup into the bowl / a bird lifts a small cup and puts it into / a parrot is taking a cap into pot / a bird moves a plastic cup into a bowl / a bird picks up a cup with its beak / a bird looking in the cup for their food / a parrot puts a container into a bowl / a bird is picking up a cup / the bird is working and its owner is give a / a bird picks up a glass with its beak and / the is eating the nuts / the is eating the nuts / a bird picks up a cup and puts it in / the bird take the and put it in the / a parrot is putting a cup of liquid into a / a parrot is moving a glass on a tabletop / a bird picks up a plastic cup containing a liquid / a bird is picking up a glass and putting it / its a parrot talking / a large bird standing on a table picks up a / a bird grabs a cup / a bird places a cup into a plate of food / a parrot is putting a small glass in the food / a parrot is taking a / a bird is eating / a parrot standing on a on the table picks / the bird put the small cup in the bowl
nZSFn51l3hc_660_666, a man is preparing something, a man is cutting up some / a person is slicing a rack of / the man cut the off the rack / someone is cutting barbecue / someone cut a rack of bbq / a man cooking his kichen / the man is cutting the / someone is cutting a slab of / the man the from the rack / this fry was nice / someone is cutting some meat / the man is slicing the / someone is cutting / someone preparing something / someone is slicing meat / a person cuts some meat / a person is cutting with a knife / starting to slice bbq / a man is slicing / a person is cutting a meat / the men cutting / someone holding a rack of with tongs slices off / a man cuts a slice from a pork meat / a lady is cutting the meat using knife / a person is slicing some meat / someone is slicing some meat
jbzaMtPYtl8_48_58, a man is doing a wheelie, a strong person pulling a big tyre / how is the man / two men compete in a tire rolling race / two men race by flipping a large truck tyre / men are turning over / the men are moving the huge / two men are moving / two men are pushing large / the men are rolling huge in a race / two men are rolling / men are rolling big tyre / men are pushing large / two men push along the ground / two men are pushing large / men are rolling / a man is lifting and pushing a tyre / some persons are lift the heavy / two people flipped in a race / men are flipping / two men are moving / two men are rolling heavy tyre / the man is lifting the weight / two man playing a game with tyre / two men are rolling the big tyre / two men each flip a huge tire down the pavement / in a race held each of the two men is / two men are flipping heavy / two men are flipping over / two men are rolling / two people flipped in a race / men are flipping large / men are pushing large / men are in a race / two men are rolling huge sideways down a street / men are flipping large in a race / the person is doing the something / a short clip about a man at / men are moving / men are flipping
xxHx6s_DbUo_216_222, a man is running, a man is / people traveling different places in the world / a man is doing yoga / a man is praying / a man is sitting cross on the ground / the man is / a man / the boy is doing the yoga / a man is seated in a garden with his eyes / a man is / a man is sitting down / a man is / an actor is closing his eyes / the man in the yard / a man is doing yoga / the man outside / a man is / the man in the yard / a couple are singing a song together / a man is when the scene flashes to a / a man performing yoga / a man is / pawan kalyan is about his dance / a man is sitting with crossed legs / the man is / a man is / a man is doing yoga / doing the yoga / a man is / a man / a man is / a man is doing yoga
z0Si1XxMibg_0_30, a dog is playing, the baby play with the dog / a dog is playing with baby / a baby is playing with the dog / a baby playing with the dog / the dog put up with the babys playing / a baby is a sleeping dog / a baby is playing with a dog on the floor / a baby is playing with a dog / a toddler is playing with a pet dog / a baby climbs on top of a sleeping dog / a baby gets licked by a dog / a baby is playing with dog / a baby is playing with a dog / a small baby is playing with his pet brown dog / a dog plays with a baby / a small boy is playing with a dog / a baby is playing with a dogs face / a baby boy is playing with a dog / a baby is playing with a bull dog / playing baby and dog / the baby is playing with the dog / a baby and hits a dog / the dog played with the dog / a baby is playing with a dog / a baby is playing with the dog / a baby pets a dog three times his size / a little baby plays with a full grown boxer dog / the baby is playing with the dog / a baby playing with dog / a baby is playing with a dog / a little kid playing with a dog / a cute baby playing with a dog / a baby is laying on a dog / a baby is playing with a dog / the baby is playing with dog / a small baby playing with a bull dog / a baby is playing with the dog / a baby is playing with a dog / baby playing with a large dog / a baby plays with a dog at home / a baby is playing with a dog / a dog and toddler are playing / a baby is playing with a dog / a baby is playing with a dog / a baby is climbing on and a dog
jW77z3-SrO4_56_63, someone is mixing dough, a lady is mixing the egg in the flour / a woman is mixing cream with some food powder / a lady preparing some dish / a woman is making dough / a person is mixing eggs into the flour / cook ready in wheat / a lady is cutting an egg into a flour and / the lady is mixing the flour with the help of / somebody is mixing the of an egg with flour / a lady is preparing dough / a woman is mixing a into a dough mixture / an egg is added to the flour and / flour is getting prepared for making pastry / in video flour is been mixed with / an egg is being mixed with flour and butter / a woman mixes an egg and flour / eggs butter and egg is being mixed on a cutting / a woman is mixing an egg into her dry ingredients / a woman mixes an egg into a pile of flour / a women cocking wheat / a woman making some recipe / an egg gets mixed into flour and butter / mixing egg into the flour / flour egg and butter are being mixed together / mixing up the flour / a woman is cutting an egg into a pile / a woman is mixing some egg with flour / a cook prepares the dough for a delicious looking cake / a women is mixing egg in the flour / a lady is mixing with egg / a woman is mixing gel and flour / a woman is mixing ingredients / a woman is mixing an egg with some flour using / a woman is mixing egg in flour / a person mixing egg in to floor / the person is mixing eggs with flour / a woman adds orange paste to flour
zSPBC8EO6dY_132_140, a man is shooting, a man sprayed down another man with a hose / a person is splashing water on another person / one man is spraying another man with a water hose / a man is using a hose to spray water on / a man is spraying another man with water from a / he has done his first flight / one man is spraying water from pipe on another man / a man is water on a pilot / one man stands in a parking lot and sprays another / a man is spraying another man with a hose / a man is being soaked with a water hose / a man off his friend / a man is being hosed with water / a man landing his small plane after his first / the man is being sprayed with water / the man is being hosed down with water / one man is spraying another man with a hose / a man is another man off with water / a man is getting wet by his friend / a man is showering water with a hose pipe over / a man is spraying water on other man / a man is down another man with water / the man is water on another man / a guy is off another guy / a man sprays another man with water from a hose / a guy is standing near the flight / one man is down another man / a man is getting sprayed with a water hose / a man down another man / a man is taking shower from hose water / a person is spraying another person with water from a / a man his friend off / a man is spraying another man with water from a / a person is giving water two another person / a man is bathing with clothes / a man is spraying another man with a hose / a man sprayed the pilot with a hose / the pilot is being sprayed by a man with a / an airoplane try to flying / a man is getting sprayed by a hose / one man is spraying another man with water from a / a man is watering on another man
zkTn5Ef1Oig_70_75, a man is dancing, elephants are washing themselves / a couple of elephants are spraying themselves with water / the elephant and her baby water on themselves / two elephants are splashing around in a river / the elephants are bathing themselves / elephants are wondering / two elephants standing on the river bank are spraying water / two elephants are spraying water on themselves with their / two elephants are spraying themselves with water / elephants enjoying in a river by take bath / two elephant are bathing / elephants are cleaning / two elephants are spraying themselves with water / two elephants play with water with their / elephants are taking a bath / elephants are bathing in the river / two elephants are splashing some water / elephants are bathing / elephants are bathing themselves / elephants are spraying water with their / elephants are playing in the water / elephants spray themselves with water / elephants are bathing / two elephants are cleaning themselves / an elephant is bathing / the elephants are splashing water / the elephants sprayed water on themselves / elephants are bathing / two are cleaning themselves in some water / video is very super / two elephants themselves with water / elephants are bathing them / elephants are bathing themselves / two elephants are sprinkling water on their body / two elephants were playing in water / an elephant is spraying itself with water / two elephants are walking in the water / the elephants are spraying water on themselves / elephants are taking bath in river
m1NR0uNNs5Y_73_78, a man is peeling an apple, a person peels half of an onion / someone is peeling a onion / a woman cutting potato / a lady is cutting onion / the cook is peeling onions / a person is peeling fruit / the person is cutting the something / someone is peeling an onion that was cut in half / a person peels an onion / a woman peels back onion skin / a man cutting something with his knife with sharp skills / someone is peeling an onion / a person peels onions / the lady half an onion / a woman is peeling an onion / a women is making dish / a woman is peeling an onion skin / onion cuting / a chef peels an onion / a person is slicing and peeling an onion / a woman is peeling an onion / a woman is peeling an onion / a woman is peeling an onion / a person is cutting some fruit / a woman is peeling an onion / a person is peeling an onion / a woman is peeling an onion / a person cutting onion pealing and chopping the onion / a woman is peeling an onion / a person is cooking / a man slicing vegitables / the woman is peeling an onion / a woman is peeling an onion / a woman is peeling an onion / a woman peels the skin off a half cut onion / a woman is peeling the skin off an onion / a woman is peeling an onion / the lady peeled the skin off the onion
hbE29pZh76I_3_8, men are playing basketball, basketball team playing at home / two teams playing basket ball / two teams are playing basketball on television / is making basket / a basketball player makes a shot / a player scores in a basketball game / a football match scene / players are playing basketball / a man is throwing the basketball into the hoop / a group of persons are playing basket ball / a basketball player the basket and makes his shot / the white basketball team made a basket / two teams are playing a basketball game / a basketball game is in play / men are playing basketball / basketball player makes great hoop shot / two teams are playing basketball and one team scores a / a basketball player dribbles towards the hoop and does a / the basketball player made a running basket / a man makes a basket in basketball / the white basketball team scored a basket / a basketball player makes a basket / a shot at the basket in a game of basketball / two teams are playing basketball and a blue team / men are playing basketball / does a fancy in an game / some players are playing basketball / a basketball match is going on / players playing football / two teams are playing basketball / a game in process / men are playing a game of basketball / men are playing basketball / basket ball is played by players / during a basketball game a player scores / men are playing basket ball / circus move / players are playing a basketball match / the basketball team got a basket / some men are playing basketball / the men are playing basketball / men are running down a basketball court / its a part of a basketball game / the man made a basket / people are playing basketball / the of best basket ball shots / mens are playing basketball
fMFvOgb4k6E_35_43, a man is playing, the girl is cleaning the forest / a women is cleaning the floor / a video has something weird nature girls / the women is cleaning the road / the lady the yard in her bathing suit / a nature girl is doing some work / a woman to the earth / a woman is gardening / a woman is using a hoe / a woman is the ground / a lady is her garden in her bathing suit / a woman in a is in the backyard / the lady the ground / a woman is a garden / a woman is cleaning a garden / a woman is the lawn / the woman is the garden / a woman is cleaning the ground / a woman leaves / a woman the ground removes something from her foot / a woman is the ground / a girl is gardening / a woman is doing yard work / a lady is cleaning the grass / the woman is using a hoe for the garden / a woman is plowing dirt / a woman is gardening / a woman is in a garden / a woman is using a hoe / a woman is gardening in a / a person is cleaning the land
xxHx6s_DbUo_41_44, a man is walking with a man, one man is carrying another man / a man is carrying a man on his back / a person taking body on his back / a man is carrying another man on his back / a man carries a woman on his back / the person is doing the excising / a man is fighting with other person / one man is carrying a man on his back while / a man carried another man on his back / a man is carrying another man on his back / a man is carrying another man / the man carried another man on his back / a man is carrying another man on his back / a man carries another man on his back / some people exercising / a man is lifting another man on his back / a man runs with a man on his back / the men are riding piggy back / a man is giving another man a ride down / a man are doing exercise / a man carries another man on his back / a man is carrying another man on his back / the man is exercising / a man is lifting the person and walking / a man is carrying someone on his back / a man is carrying the other man on his back / a man carrying a man / pawan kalyan is running with the man on his back / a man is carrying another man on his back / a man is walking with another man on his back / a man is carrying another man / a man is giving another man a piggy back ride
k5OKBX2e7xA_19_32, a man is riding a bike, the rider is doing motorcycle tricks / a men is presenting the show / a person is performing tricks on a miniature motorized bike / a man is riding the bike / the person is bike riding / the man is doing motorcycle tricks / a monkey is doing a wheelie on a motorcycle / a funny race / monkey stunt riding is well / a man is doing stunts on a motorcycle / a monkey stunt riding / a man is performing bike stunt / a man is doing trick on a motorcycle / a man doing stunt raiding in / he is driving the bike / someone is doing stunts on a motorcycle / a man is riding a bicycle / a man is wheeling a small motorcycle / someone is riding a motorcycle with the front wheel / a stunt biker spins around on one wheel / a motorcyclist rides on a single rear wheel / a man is riding a bike / a boy is riding a bike while standing on it / a person stunt rides a / a man riding a motorcycle / a man does wheelie on a bike in circular / a guy is riding a wheelie / a kid is doing stunts on a motorcycle / a man is performing bike stunts / a man performing some sort of stunts on a small / a man is performing a stunt on a motorcycle / a person stunting on the bike / the man did circles on the back tire of his / someone is doing a motorcycle stunt / a man is doing motorcycle tricks / a man rode his motorcyle on the back tire / a man does a wheelie trick on a motorcycle / a person does tricks on a mini motorcycle / a person is doing wheelies on his motorbike / a man performing some sort of dangerous stunts on a / a man is riding a motorcycle in circles while balancing / a boy on his bike
vfktGc_qx-w_2_18, a man is riding a motorcycle, a man and woman performing stunts with their motor bike / a girl standing on the seat of a motorcycle / a girl stood behind a boy on a motorcycle / two people are doing tricks on a motorcycle / a car is moving on a road / a man rides a motorbike on its back wheel while / a man and woman rode a motorcyle on the back / a couple are riding a motorcycle / two guys are driving the bike / a man and woman are riding in the bike / a couple doing a stunt on a motorcycle / a man is riding on a bike / the motorcyle riders are doing a stunt / a girl and a boy trying to perform some serious / a man is wheeling a bike on a long stretch / a man is performing bike stunt / an amazing action on bike / a woman is standing on the back of a motorbike / a guy is riding a motorcycle with a girl on / amazing action on bike / a girl stands on the seat while a man drives
