fHfpMUDrQCs_17_31, a boy is standing in the room, bruce is drying off a woman / a man cover the lady with some kind of towel / the two person is talking / a man is a girl / couples were speaking / a short clip from a hollywood movie showing a man / a man is talking to a woman / a man is up a woman with a blanket / a man is rubbing the arms and shoulders of a / a man is talking to a girl / a couple is inside the ship / the / a man rubbed a girls shoulders with a towel / a man off a woman / a man is drying a woman with a towel / a man is hugging a woman / a man is drying off a woman with a towel / man off woman / a man is a woman up with a towel / a man rubs a wet woman with a towel / a man is wiping water / bruce is drying with a towel in / a man is drying off a woman with a towel / a man is off a woman / a man wipes and rubs a wet woman / a man off a woman / a man is drying off a woman / a man is cleaning the womans shoulders with cloth / a man is cleaning a girl clothes / the man is drying the woman with a towel / a man is drying off a woman with a towel / a man and woman are standing together in a small / a man rubbing a womans hands / a man is touching a lady / a man rubbing women hands / a man is rubbing towel on the women / a man rubbing a lady with towel / a man is drying a girl off with a towel / the man rubbed the woman with a towel / good and couple / a couple is standing in the ship
g9aZcaEg7iY_0_9, a cat is jumping, a man fell down the stairs / a man falling down stairs / a man is falling down a flight of stairs / a man fallen on the floor / a drunk man is falling down the stairs / a man is falling down stairs / a person is falling down from stairs / a person is falling down the stairs / person falling down the stairs / a man falls down the stairs / a man is falling down from the stairs / drunk man falling from steps / a man falls down a flight of steps / the man fell down the stairs / a man is falling down on the stairs / a man is falling from stairs / a man is falling down the stairs / a drunk man falling from the steps / the man fell down the stairs / a drunk man is falling down from the stairs / man has fallen down from the stairs / a drunk man is falling down a flight of stairs / a man is falling on the stairs / a man who is drunk falls down / a man falls down the stairs and smiles / a man falls down the stairs / a man is seen falling down a staircase onto the / a man falling down from the stairs / a guy down the stairs and then gets up / the man is falling from the stairs and standing with / a man falls down the stairs / a man is falling from stairs / a man is falling down the stairs / a man is falling down stairs / the man rolls down the stairs / a man falls down the stairs / a man falls down stairs / a drunk man fall down from the steps / a drunken man falling down from the stairs / a man down the stairs / a man is falling down the stairs / a man falling down the stairs / a man have an / the man down the stairs / the man down the stairs / a man is falling down the stairs / a man from the stairs when coming coming downstairs / a man falling down stairs / man falls down the stairs / a man falls down the stairs / a man rolls down a flight of stairs / man falling down from stairs
x8Ul09tk6zk_0_8, men are playing basketball, a basketball player shoots a free throw / a man shoots a the basket / a young man making basketball shot / a man is standing at the free throw line of / a man is free throwing a basketball / the basketball player makes a shot / a man shoots a basket / a man throws a basketball into the net standing near / a basketball player sinks a free throw from the / a basketball player shoots a basket / a basketball player the ball / a young man is throwing a basketball into a basketball / a basketball player shoots a goal / one basket ball player making a goal / a man slowly makes a / man shooting on basket and he / a man is throwing a ball into basket at basket / a man is throwing a basketball into a basketball hoop / in video a player is throwing ball in the basket / basketball player makes a shot / japanese basketball player shoots some free throws / a person practices a shot in the gym and / an asian man is playing basketball / a chinese man aims and shoots a basketball into the / a boy is throwing a basket ball in a basket / the boy baskets the basketball / boy playing basket ball / a player scores a basket / the man puts the ball into the basket / a young man is throwing a basketball into the hoop / a basketball player is scoring a basket from the free / the basketball player made a free throw basket / a guy is shooting a free throw / a goal in one / a player throw the ball to put in basket / a guy is shooting the basket ball through a high
xxHx6s_DbUo_182_186, the man is doing the something, the man is cracking a concrete slab / a man is breaking a brick slab with a hammer / a man is breaking a concrete slab placed over a / there is break the stone / the broke a concrete slab over a man / someone is breaking a slab of concrete on a mans / the man broke the concrete on top of the mans / the man broke the cement block on top of the / one man is laying on a table with a slab / great song nice to good hard / song / a man is hitting concrete on another mans with / one man breaking the stone with / a man breaks a board / a man is concrete / the boy is doing the excising / a man is having concrete broke on his stomach / a man is breaking a slab of rock / the man chopped the cement block on the man / a man hammers a slab of concrete on another man / the person is crying / a man is smashing a concrete block on a man / a stone is cracked by a person by hammer / a man is broken a stone / a man is breaking concrete with a sledge hammer / a man hammers a concrete slab on a man / a concrete slab on top of a man is hit / a man is laying under a concrete slab while another / a man breaks a slab of concrete in half that / it is a song / a man breaking a stone kept on an another mans
v-9Gx0gJmfo_91_99, a girl is singing a song, a woman is rowing a boat / a women paddles a boat / a woman is traveling in a boat down a river / a woman is paddling a boat across the water / a lady riding a boat in a river / the woman is paddling a boat / a woman is on a river / a woman is rowing a boat down a river / very nice and song / a lady is rowing a boat / a woman is sailing the boat / an artist dancing and singing in a movie scene / a woman a boat / a woman is rowing a boat / the woman is rowing the boat / a woman a canoe / a woman is rowing a boat / a woman riding boat / the lady her boat in the river / the woman is paddling a canoe / song is supper / a girl is riding into the boat / a woman is rowing a boat onto a shore / the girl the boat in the river / a women travel in the boat / a woman to shore / a girl is rowing a boat / the lady in the boat / a woman is a boat / a woman is paddling a canoe to the shore / a woman is rowing a boat / a woman is rowing a boat / a woman paddles a canoe and then / a woman is paddling a boat / a woman is rowing a boat / one lady is sailing in the boat / the girl is boating the water / a woman is paddling a canoe down a river / a person going in boat / a woman is paddling a boat / a woman is rowing a boat
puineN1UMto_25_29, a cat is playing, a computerized squirrel is dancing / a squirrel dancing to music / a squirrel is dancing and singing / a squirrel is dancing / a squirrel is dancing outside / an animation in which a squirrel is dancing / the squirrel danced on the lawn / a squirrel is hopping / a squirrel is dancing / a squirrel is dancing / a squirrel is dancing on the grass / a squirrel is dancing on a grass field / one squirrel is dancing / featuring a squirrel / the animal is seeing / a squirrel is dancing / a squirrel is singing and dancing / a squirrel is dancing on the grass / the squirrel is / a squirrel is hopping back and forth in the grass / in this video the squirrel is dancing to approach its / a squirrel is dancing in the grass / a squirrel is dancing / an animated squirrel is dancing / a squirrel is singing / the squirrel is dancing / a squirrel dances / a squirrel is standing on its hind legs dancing / a squirel is dancing / a squirrel is dancing in the grass
x1i0UOssll8_141_151, a shark is swimming in the water, a shark is following a / a shark eats a fish / a shark is eating a fish / shark catching prey / a shark is eating small fish / a shark is attacking a fish / a shark chases another small fish near the surface of / a shark takes the / a shark up a small fish / a shark is being caught on a net / the shark ate the / a man tries to in a shark at sea / a shark eats being pulled through the water / the dolphin caught a fish in the water / a shark is swimming in the ocean / a shark is eating a fish / the dolphin caught a fish in the ocean / the shark ate the fish / a shark is escaping from the / shark chasing a small fish and eats it / we can see by in sea / a shark taking the / the is taken by a shark / a shark is catching a fish / a shark swimming in the sea / men fishing in the ocean a white shark / are swimming around a boat / a shark catches a small / a big fish swimming in the sea / a shark is eating a fish / the dolphin caught a swimming fish / a shark is catching a fish / a large fish catches a smaller fish / a small fish is been eaten by shark / a large fish is being in / the fisherman are trying to catch a shark / the dolphin caught a fish in the water / showing / a shark is stealing someones fish / a shark is coming out of water / a shark chasing some / a shark attacks and eats a fish / a shark is going after the
haJn6k5zVnE_1_23, a man is playing a keyboard, a man is playing an electronic keyboard / the man played his keyboard / the boy is playing the key / a man is playing a keyboard / player / a man is playing a keyboard / a man is playing a keyboard / a man is playing a musical keyboard / the man is playing the keyboards / a man is playing a piano / a man is playing on his keyboard / a man is playing a piano / a man plays the keyboard / a man is playing keyboard / the man played the keyboard / a man is playing a keyboard / a man is playing the keyboard / a man plays the keyboard / a man is music / a man plays a keyboard / a man is playing a keyboard piano / a man plays the keyboard piano / a man is playing a keyboard piano / a man is playing keyboard / the man playing music / a man is playing a song on an electric keyboard / a man plays on the electronic musical instrument / a man is playing keyboard / a man is playing a keyboard / a man is playing a keyboard / a man is playing a piano / a man playing key board / a man is playing on a piano / a man plays a piano / a man is playing an electric keyboard / a man on piano with computer / a man is playing an electronic keyboard / a man playing piano / the man is playing the keyboards / a boy is playing casio / a boy is playing keyboard
w28TljSqtW8_64_75, a man cooking his kichen, a man is slicing onions with a mandoline slicer / a man is slicing some onion / a beautiful lady working in the kitchen / the surface of the earth is full of water / a man is slicing an onion / a men cuting onion rings / a person show how to cut a onion / a man slices an onion / a man is grating a vegetable / a cook is slicing an onion using a mandoline / the man is cooking something / onions are being sliced / onions are sliced into thin slices / a man uses slicer to slice onions / someone is an onion / a person is slicing onions with machine / a man is slicing onions / the man is slicing onions / a man is slicing some vegetable / a man is cutting an onion / a chef is slicing onion to get onion rings / the man grated an into slices / a man is slicing onions with a mandolin / a man slicing onions / a man is slicing onions / a male chef is onions / a man is slicing onions / a man is slicing a white onion with a mandolin / a man is slicing an onion / a man crushing onion inorder to make some recipe / a man is slicing / a chef is cutting onions / a man is slicing onions on a mandolin / a man slicing a onion / someone sliced an onion / the man is slicing onion using a mandolin / a man thinly slices onions with a slicer / a onion rings / the man is teaching how to make onion rings / a man is grating the onions / a man is spreading an onion by a machine / a man slices onions to make onion rings / a man slices a whole peeled white onion using a / a man is slicing an onion into rings / a chef is scraping onion / a man cutting potato / a man slicing onion / a man is slicing onions / a man slices onions / a person is slicing onions into rings on a slicer / a man is cutting onions / a man is slicing vegetables / someone preparing something
ymC2bNi6-Is_9_19, a man is looking at a chair, the men made with their hands / the about life /  / one man for another man to come to him / a men in / a man flips someone off / a man makes a to his that / a man is showing his figure / looked for fight / a short clip about in / a man flips the middle finger to another man / a man is martial art / video is this / a man in a cell is a man / a man is sticking up his middle finger / a man flips someone off / a man is making some fight movements / boy is practising / a man showing middle finger / a man is speaking an another man / a man is fighting in / tow persons are showing / two men are each other / a man showing the thumb / a man is calling somebody to fight with him / they are fighting / two men are to each other / one gives another the middle finger / the men gave hand signals to each other / the men are in / a man gives another man the finger / a man is showing his middle finger to another man / the person is doing the something / a man gives the middle finger / a guy is talking to another guy / a man showing stunts / two men are to from / a man in a cell to a man / one man gives another man the middle finger / two persons calling each other / a man is raising his middle finger / a man flips off another man / a man calling other man / a man is another man / a man gives another man the middle finger / two guys each other
lv8d_qLLqsk_1_20, a man is playing a guitar, a man is playing the guitar and singing / a man is singing and swimming / a man sings and strums an acoustic guitar / a man is playing guitar / a man is singing and playing the guitar / a boy playing a guitar / a man is singing while playing guitar / a man is playing the guitar and singing / a person playing a gitter / a man is playing a guitar / a person is playing guitar / a man singing a song / a man plays a guitar / a man plays a guitar / the man play the guitor and sing / the man is singing and playing the guitar / a man is playing guitar in the room / a boy is playing a guitar / the man played his guitar / a boy playing some sort of notes on a guitar / one boy is playing guitar / a man in a green tshirt playing the guitar / man playing guitar and sing tamil song / a man is playing guitar / a man is singing and playing a guitar / a man is playing a guitar and singing / a man plays the guitar / the person is playing guttier / a man is playing a guitar / a man is playing guitar / a man plays the guitar / a man playing guitar / a man is playing a guitar and singing / the man played his guitar / a men playing the instrument / the man is singing and playing the guitar / a man is playing the guitar / a man is playing the guitar / a man is playing a guitar / a man playing gitar / a man is singing and playing a guitar / a young man plays the guitar and sings a song
xSmfK498DjI_1_20, a woman is exercising, nice knife trick performed by a chinese girl with single / a girl is playing with knife / a girl is doing tricks with a knife / a woman seated on a chair a knife rapidly / the lady flipped a knife around / a woman is doing tricks with a knife / one girl is playing with knife / a girl is flipping a knife open and closed / a woman is playing with a knife / the girl is playing with a knife / a girl is take any thing / a woman is flipping around a knife / a woman is flipping a knife / a girl is playing with a knife / a woman s playing with a knife / she is playing with knife / the girl flipped a knife around in her hand / a woman is playing with a knife / a woman is demonstrating a knife / a girl is flipping a knife / a woman is performing tricks with a knife / a girl is twirling a / a lady doing some tricks with the knife / a woman is doing knife tricks / a woman is performing knife tricks / a woman does tricks with a knife / a woman is doing some tricks with knife / a woman is flipping a / the woman is playing with a knife / a woman is and twirling a knife / a lady playing with a knife / the lady beautifully use the knife move and / a woman is doing some trick with knife / a woman spins a knife around / a girl is demonstrating a knife / a woman demonstrates knife flipping skills / a woman is moving a knife all around / a lady circle the knife by hand
p7IAuvd87hQ_12_19, a girl is riding a horse, three girls are riding in a cart / the girls are riding in the horse cart / three girls are riding in a cart pulled by a / some girls horse cart riding / a lady and children are travel in the horse cart / a family riding a horse on a two wheel / three people are riding a horse and cart / a woman and two children in a are being / three girls are riding on a cart pulled by a / three girls in colorful dresses riding in a horse drawn / horse cart is driven by girls / people are riding a horse drawn cart / girls are riding in a horse buggy / a horse is a family / 3 people ride in a horse cart / a horse is pulling a cart / three ride in a horse drawn cart / a horse pulls children in a cart / three girls are riding in the horse cart / a woman and two girls are taking a horse cart / girls are riding / a horse draws a with three people in it / two little girls for a ride in a horse cart / the little girls rode in a / some girls horse cart riding / people ride in a horse drawn cart / three girls were going horse ride / three children are riding on a horse cart / girls enjoying a ride on a horse cart in a / three people are on a cart being pulled by a / girls on horse cart / some children are riding on a horse cart / three children are traveling in a horse cart / three woman are going on a horse cart / girls were enjoying horse ride / horse cart ride / a horse is pulling kids / children playing with horse / three women are riding a horse / girls are riding in a horse / people riding in a cart / girls are riding in a horse cart / the two girls rode a cart / a black horse is on a pulling a / three people are riding a cart being pulled by a / super horse cart ride / three people are riding in a cart pulled by a / three woman are riding in a cart pulled by a / the girls are riding in a / a horse is pulling three girls on a cart / the girls are going in cart / a horse pulls around three people in a cart / a horse riding / a horse is pulling three people in a cart / the woman and girl are in a horse drawn / 3 girls going on horse cart ride / three go on a horse cart ride / a horse is pulling three people in a cart / girls are riding a horse cart
rlQ2kW-FvMk_66_79, a man is doing exercise, a man is using a model to explain an exercise / a trainer is showing us how the woman exercises / a coach teaching / a woman is doing exercises with a man explaining what / someone is exercising / a man a woman as she does exercises on / a man is an exercising woman / two people demonstrate an exercise / a man demonstrating a women performing exercise / a man is training a woman to do exercises / the trainer demonstrated how to stretch the leg / a woman using the correct form while / a man teaching exercise to a girl / the woman is exercising / the couple are showing exercises / a man and woman are exercising / working out in clothes / a aerobics shows how to work out the butt / a woman exercises while a man explains her / a man is training a woman to exercise / a man is trained with model girl / a woman demonstrates exercise moves while a man / two men were fighting / a man is showing the / a woman is doing leg lifts / a women demonstrates how to exercise to get a / a girl is taking exercise / a man is teaching exercise to a girl / the trainer the girl stretch / a man is teaching aerobics to a woman / a man is instructing or describing a woman who is / a men and women is doing exercise / a woman is exercising / the person is telling how to do exercise / a man and a woman are working out / a man giving training of aerobics to a woman / a man and woman demonstrate an exercise / a man teach a girl to do an exercise / a lady is doing some exercise and a gym / a woman is doing exercises on a mat while / the woman is exercising
qNjeEx92rTA_281_299, a man is preparing a dish, a man stirs chocolate icing in a bowl / demonstrating to make a chocolate cake as mixing and making / a woman shows how to make chocolate cake / a person is mixing cake batter in a bowl / cake batter is being mixed / someone is mixing chocolate / the cook is stirring the batter / mixing up the chocolate with spoon in the bowl / a woman is mixing cake mix / a person is mixing cake batter / one person make a / someone stirred up chocolate pudding / choclate cream was prepared on a bowl for making choclate / a yummy chocolate cake ready to be eaten / the batter is mixed into a thick / a man preparing the chocolate cake / a man is explaining the while chocolate / the man is stirring a bowl of chocolate batter / a woman is stirring a chocolate / a man mixing chocolate in a bowl / a man is mixing chocolate in a bowl / a person is stirring chocolate mix / a baker stirs batter for a chocolate cake / a woman is mixing chocolate batter with a spoon / someone is mixing up chocolate batter in a bowl / a person is mixing a batch of chocolate with a / a baker mixes cake batter / a man is stiring cake batter in a bowl / a woman stirs cake batter with a spoon / a man is mixing chocolate / a man mixes chocolate / someone is mixing melted chocolate in a glass turning / a chocolate mixture is stired / a person is mixing ingredients for making a cake / someone is stirring cake batter / in the kitchen makes a chocolate mud cake / a man is whisking a chocolate cake mixture in a / the cook is stirring chocolate batter / making paste of chocolate in a for making cake / somone is mixing batter / a man is showing the process on how to / the lady mixed the chocolate cake batter / man mixing a choclate mixture / making of chocolate cake
zTn-nNj5Bng_61_77, a man is riding a horse, someone is riding a horse / a woman is riding a horse / a woman is riding a horse in an open ground / the and rider trotted in the field / a man is riding in the horse / a person is riding a horse / a man riding on horse / a woman is riding a horse / a man is riding a horse / a man is riding on the horse / a person is riding a horse / people are riding a horse / a person is riding a horse / a horse rider is riding his horse / the woman is riding a horse / a rider on horse trots then / a man ride on a horse / an individual rides a horse around a field / a rider their horse in show / the man is riding the horse / a riding a horse / a woman is riding her horse / a man is riding a horse / a man is riding the horse / a woman galloping on a horse / man riding horse / a player taking some kind of training on a / a person is riding a horse / a man rides a horse the on ground / a man riding horse / one man riding on a horse / a men walking on horse / a person rides a horse on a track / someone is riding a horse / a woman is riding on a horse / the is riding in r race horse / a man is riding on the horse / a guy is riding in the horse / the horse and rider trotted in the field / a man riding a horse / the horse and his jockey / a man is riding a horse on a track / a horse is around a course in a field / a person is riding a horse / horse riding for men / a man is riding a horse / a woman riding in horse competition / a man is riding on a horse / a woman rides a horse / a man riding with horse / a girl is riding a horse / a person is riding a horse
k4hhWYtaQ14_0_10, a dog is playing, the baby and the dog played with the ball on / the little girl played with the ball and dog on / an animal plays with a baby / a puppy plays with a toddler / a baby is throwing a ball on a dog / playing baby with doggy / a baby is playing with a dog / a baby is playing ball with a dog / a dog is playing with a baby / a child is playing with the ball / a baby and a dog are playing with a ball / the baby playing with ball and the dog / a baby is playing with a dog and a soccer / a puppy is playing with a baby / a young girl is throwing a ball at a puppy / a small boy is playing a ball with a dog / a baby plays with a puppy / a girl is playing with a puppy / the cat playing / a child playing with dog in / a dog is playing with a baby / the dog and baby are playing / a baby and a dog playing with a ball / a baby and a dog play with a ball / a baby and a dog play in the yard / cute baby and funny dog / a baby playing with a puppy and a ball / a child is playing with dog / a baby is playing with a dog / a dog and a child are playing / a baby and a puppy are playing together / a baby and puppy is playing with a ball / a baby plays with a dog and ball / a baby plays with a dog / a toddler is playing with a pet dog and a / a small baby and a puppy are playing with a / the little girl played on the grass with a dog / boy playing with dog and ball / the baby is playing with a ball and dog / a toddler is playing with a puppy and a ball / a baby playing with a puppy / a dog is playing with a kid / a dog and a child are playing together / a kid playing with a puppy / a toddler and a puppy are playing / a baby is playing with a dog
