lB1UPJ4leqs_1_6, a woman is lying on the bed, a girl wakes up in bed / the girl is wake up / a girl is laying in her bed / a baby is getting on the bed / a girl is from sleep / a little girl wakes up in bed / the little girl sat up in bed after waking up / a girl is waking up / a girl is waking up / a girl is sitting up / a child is waking up / a woman starts getting out of bed / a young girl lying in a bed appears to wake / a girl is waking up from bed / a little girl is sleeping in bed and then wakes / a little girl is waking up / a child in bed is waking up / happy to help / one little girl is sleeping on bed / a girls wakes up from bed / the girl woke up from sleep / the little girl woke up from her sleep / the little girl rolled over and sat up / a girl wakes up from bed / the girl woke up / the baby is sleeping
xTd_IdIcB4s_2_10, a woman is lifting a car, a little boy is walking on a treadmill / kid is excercising / a baby is going to exercise / little boy walking on a treadmill / a little boy is walking on a treadmill / a kid is walking / a boy is walking in a treadmill / a man is doing excersise / a boy is walking on a treadmill / a young boy is walking on a treadmill / a little kid is walking on a treadmill / a baby walk on a / a little boy is walking on a treadmill / a small boy is walking on a treadmill / a baby is walking on a treadmill / a man exercising with a baby / a toddler is walking on a treadmill / a little boy is walking on a treadmill while an / a toddler plays on a treadmill / a baby is exercise / a baby enjoying in exercise machine / the toddler walked on the treadmill / a baby is walking on a treadmill / a young child is walking on a running machine / a child walks on a treadmill / a boy running on a with his mother / a toddler is on a treadmill / a small child walking on a / the boy is running on running / a baby is walking on treadmill / a little boy is walking on the treadmill / the child funny video / a toddler walking on a treadmill / a baby child is doing exercise on with her / a baby is walking on the exercise machine / a baby is walking on a treadmill / a toddler walks on a treadmill / a toddler is walking on a treadmill / a man is doing / the boy is running on a running machine / a baby is practicing exercise / a woman a baby to walk on treadmill / the baby is walking on the treadmill / a toddler is exercising on a treadmill / a cute baby is walking on the floor / a small boy is walking on a moving treadmill / a kid is walking / a small child is walking on a treadmill / a toddler is walking on a treadmill / a little boy is walking on a treadmill / the toddler walked on the treadmill / a boy is walking on a treadmill / a baby is walking on a treadmill / a toddler walks on a treadmill as a woman stands / a little boy is walking on a treadmill / a boy and men doing exercise
mZVPkPqwzR4_38_45, the dog is swimming, wild animals are running / different of dear are roaming in the forest / a set of crossing a road / the herd of deer crossed the road / animals are crossing the road / deer crossing the road / deer are walking across the road / animals are running / deer are running accross a road / a group of are crossing a road / are crossing a road / many are crossing the road / a group of deer cross the road / black running in the wild / a herd of deer are crossing a road / a herd of deer cross a road / a group of deer are crossing a road / a herd of deer are crossing the street / deer run across the road into a forest / a are running / many deer cross a road / are crossing a road / deer are crossing a road / a group of deer cross the road in a forest / the deer crossed the road / a group of are crossing road / animals are going the line / animal / animal is running / a group of deer are crossing a road / are passing the road / a herd of deer are crossing the street / the deer are crossing the road / a group of crossing a highway through the jungle / several deer are toward a forest / some or animals are crossing a road / some animals are running / some white mountain is going on forest / some deer are crossing a road / deer are crossing a road / some are runing / the herd of deer crossed the road / a herd of are crossing a road
gMqKUPeTAkg_17_30, a cat is playing with water, a black cat is drinking water from around the / a cat is drinking water from running tap / a cat is drinking in basin / a cat sticks its head under a running faucet / a cat is drinking water / the cat is drinking water from the wash basin / the cat drank water from the running bathroom sink / a black cat is drinking water from a sink with / the cat is washing his head under the faucet / the cat is drinking from the sink / the cat is washing his head under the faucet / a black cat washes his head in a sink / a cat is drinking water out of a sink with / a cat is drinking water from a sink faucet / a cat is sticking its head under running water / a cat is drinking from the sink while the water / a cat is drinking water from a sink / a cat is washing its head under a faucet / a black cat is drinking water standing inside a sink / cat drinking water out of sink faucet / the cat drank water from a running sink / a black cat is getting wet from a sink / a cat is washing its head under a tap / a cat is drinking water in a / a cat drinking water from the tap / a black cat the water / a cat is drinking water on the sink / a cat is drinking out of a sink / a black cat gets wet while drinking from the faucet / a cat is drinking water from the sink / a cat is drinking from a faucet / a cat is drinking out of a sink faucet / a cat is drinking water from basin / a cat is drinking the water / the water from the sink is pouring on the cats / a cat is drinking a water / animals are drinking water / a cat is drinking water from a sink / a cat drinking water out the sink / a cat is drinking water / a cat is drinking water / a cat is drinking water from a bathroom sink / a cat is drinking water in the basin / a cat drinks water from a sink / a cat sticks his head under a running faucet / a cat is playing with water in a washbasin / a cat drinks from the bathroom sink / a cat is drinking water in a sink / black cat drinking water under tap of a wash basin / a cat is drinking water / a cat drinks from the sink / a cat is drinking from the sink as the running / the black cat is drinking water from the pipe attached / a black cat is drinking water from a wash basin
zr9OeyfLPPY_4_9, a man cooking his kichen, master the / a shark and human toy are moving through a tub / a toy shark swims in a bathtub full of red / bath toys are swimming / two electric toys are swimming in red water in a / a young woman with dark lipstick on sitting a / the lady take bath the doll and fish other toys / she take both / a lady is bathing / plastic toys are floating in water / toys are in a tub of water / the toys are in the tub / a toy fish is running on red water / a woman in a pool of / a woman is dead in a bathtub / a woman in bath tub with / a woman is bathing in / a woman is taking a bath with toys / the bath toys swam in the red water / a fish swims in water / toys are moving in a tub / the toys are in the tub / a fish is swiming / a person is / the women is bathing / the play and shark swam in the red / the person is cooking / a toy fish is swimming / toys are floating in a bathtub / toys are floating in red water / a toy shark is swimming in a bathtub / toys are moving in a bathtub / toys are swimming in a bath of red liquid / a toy fish is moving in water / a girl with black lipstick on is laying in a / a toy fish is swimming in the water / a fish is swimming / the tub toys moved toward the girls head in the / are killing a woman in a bathtub / the toys are moving in the water / a toy fish is swimming
qeKX-N1nKiM_133_142, a person is cooking, the woman is frying vegetables / a person is making / someone is frying something / a woman is coating a small piece of something in / someone is putting vegetables into hot oil / a woman is coating vegetables in a bowl of flour / the lady added the batter dipped food to the hot / a person is frying / a person fries / a man is cooking using hot oil / a man cooking his kichen / a woman is frying food in a pot / an asian chef is frying seafood / the lady dipped the fish in batter before putting it / a person is and frying food / a man is placing vegetables in a pan of / a cook puts some vegetables into a pot / a person breads a vegetable and puts it in a / someone is frying stuff / the woman is frying pumpkin / a person is frying food / the person is cooking the something / sliced vegetables are dipped in batter and deep fried / a person is placing ingredients in hot oil / japanese food is fried / vegetables are being deep fried / a woman is putting vegetables in batter and then deep / a lady is preparing food / a person is making the tasty japanese food / a person is dropping food into a pot / this vidio shows that how to make / anyone is making dish / the lady added the batter dipped shrimp to the oil / a woman is frying something / in this video cook / cooking the japanese food / a person is cooking
hEOGZoYSvT4_82_86, a man is running, one little girl is running / a little girl is falling after running along a bench / a girl is falling / two girls are playing in the hall / this is the first part to from / a girl falls down / a girl falls down / the girl ran and fell / the girl fell down / a little girl is running and falls down / a girl falls down while playing / a little girl is playing and falls down / the kids are playing / a girl falls down on the floor / a young girl is running alongside a bench sliding her / a girl is falling down / two girls are playing and one falls down / a young girl is falling down / a little girl falls down / a girl is falling down / a small girl fell down while playing / the little girl fell down while racing a car on / a girl running and rolling something down the / a little girl is playing and falling down / a running girl falls down / a girl falls down on the floor / a girl falls over
pqTWUzehCUM_42_47, a boy is riding a skateboard, people flying in the skies and skating on / two men waved at a car and two / two men sign to us as we drive by and / two men are skating on skateboards / two guys are long boarding down a street / two men are skating / two boys are skating on the road and two men / two boys are ridding on skateboards / two boys are skate boarding / two are the streets / two men are kneeling on moving skateboards / two boys are scating on the road / two guys are skateboarding / two young men are skateboarding along a street / two boys goes skateboarding in a town and down a / two men are / men ride around beautiful / two kids ride their skateboards / two guys skating downhill / two young men are long boarding down a hill / two men are on their friends who are / two men give a to each other as they / boys are skateboarding / two men are riding skateboards down a road / the two boys are riding their skateboards / two boys are skating on the road / two guys skateboard together / two boys are on the road / some men are skating on the road / two men to cars and two boys skateboarded down / are skateboarding / two men are skateboarding / people are performing on
fnpp8v9NbmY_181_188, a person is mixing ingredients in a bowl, a woman is preparing for / lady is prepairing / the lady formed balls out of the dough / a lady made a ball out of the dough / a woman is picking up dough / a woman takes a small of wet thick batter / a woman is preparing / a woman is taking paste to cook / the cook is forming dough / a person is forming a wad out of a mixture / someone preparing something for / a cook rolls some cream in his hands / a person takes some dough out of a bowl / somebody is mixing flour / they are showing how to make / a woman is batter with her hands / a woman is preparing flour to cook something / a woman is making dough balls with her hand / a cooking portion / a woman making the south indian recipe / a lady take a dough from the glass bowl / a person is preparing / a women show how to make a / a woman is making a ball out of raw dough / someone is mixing dough / someone forms dough into balls / a woman is cooking / a south indian recipe is placed on the table / dough is being shaped into form by hand / a woman is dough / a woman making / the person showing how to make / a woman is teaching how to make / a person making / a girl is teaching how to make a something / someone pulls a wad of batter from a bowl / someone has picked up a handful of some white substance / a woman is getting dough out of a bowl / preparation of south indian / a demonstration of a recipe is being shown / a short clip about cooking south indian recipe / a person is making a ball of dough / a woman is scooping up a small portion of white / a person dough
yOnRm3TP6hM_0_12, a cat is playing, a beautiful walk by a dog / a pug puppy sliding back himself with his feet / the puppy is moving backwards / a puppy pushes himself backward across the floor / a puppy is backwards on his butt / a puppy is backwards on the floor / a puppy pushes himself backwards on a wooden floor / a puppy dragging himself backwards slowly / a puppy walks backwards / a kitten sliding backwards on its bottom / a puppy is backward on the floor / the puppy is drinking milk / a puppy is backwards on floors / a puppy backwards on the floor / puppy on the wooden floor / a pug puppy slides backwards on a wooden floor sitting / a pug is moving around in a way that / a new born puppy is walking through its mom / a puppy is sliding backwards on the floor / a puppy is walking backwards / the dog backwards on the floor / a dog is crawling backwards / a puppy is walking backwards / pug / the dog puppy is playing / a puppy dog is walking backwards on the floor / a puppy is pushing itself backwards / pug puppy to backwards with his front paws / a puppy sliding on the floor / a puppy dog is moving slowly to its mom / a puppy is pushing himself behind / a puppy sliding on floor / a dog doing walk / a puppy is sliding backwards along the floor / a puppy is walking backward / dogs playing with his mother / a puppy is walking backwards / a pet is walking back / a puppy is moving through the floor / a puppy is walking backwards after feeding / a pug puppy slides backwards on a wooden floor / the puppy slid backwards on the floor / a puppy sliding backwards on the floor / a puppy dog is with mother / the puppy backwards on the floor / a puppy is doing the / a puppy pushes himself across the floor / puppy sliding away from its mother / a puppy across the floor / a puppy walks backwards / the pet pug is moving backward / a puppy is backwards over a floor / a small puppy is moving back on the floor / a dog pushes himself backwards along the floor / a baby pig is himself backwards with his front
v5CeGLEnVFE_0_8, two men are playing, monkeys are river dancing / several monkeys are dancing / some monkeys are dancing / are dancing / a line of monkeys do a river dance / the monkeys are dancing / monkeys dance / monkeys are dancing / the monkeys tap danced in a line / a group of monkeys are dancing / monkeys are playing / five monkeys are dancing on the counter / some are dancing / some are dancing / are irish step dancing / the monkeys are dancing / a group of monkeys are dancing / monkeys are dancing / several monkeys in a row are doing an irish dance / a group of are dancing in a line / a group of monkeys are dancing in a line / are river dancing / a line of are doing the river dance / the monkeys are dancing on the stage / the tap danced in a line / are dancing / the are dancing / monkeys are dancing
pUPKsHTDZTo_70_85, a man is standing on a fence, two men are carefully working on a building standing on / two men are walking on a construction high in / two walking on high / someone is standing on a high object wearing a / the men worked on the bridge / two men are walking on top of a tall structure / a person is climbing / the person playing on the / hanging / two people are standing on a thin construction platform / men are walking across a building / two people are walking on a high structure / construction working high in the air / two climb up to fix the / two man s at work on the roof / the doing some hanging iron / these people jumping from height / the person is walking on the / a man is standing in a huge wall / the men are up high on the / two men working on a construction / two people walk across a beam / two men are doing high construction work / two men trying to get hold of the hook / men are working at a construction / men on a steel / getting ready to get themselves tied to the hook which / some people were hanging at on 13 / mens are trying to on the hook / two person is standing on a pole / two people carefully walk on a ledge / two men are climbing rope / two men working on a high building / a dangerous hanging stunt performed by a man / two man are standing on the wall / men are walking on a steel / two men standing on a steel at a height / hanging / two construction are climbing a structure / two men are climbing a construction / a man is walking a very high plank / two are standing on some pillar / the men are walking high up on a construction building / two men work on steel / the two men are standing up on poles / two people are standing on a fence carrying some kind / two men are standing on the iron bar / the men climbed up the metal / some men are shown walking on very high in / two construction are walking on steel of a / two man is trying to perform some stunt / a amazing vedio
kWLNZzuo3do_17_23, a man cooking his kichen, a woman is slicing a leek / a woman is chopping a vegetable / a woman is slicing a with her poodle / a woman is slicing an onion / a woman is slicing vegetables / a woman cuts up vegetables / a woman is cutting up a leek / the lady cut up a green onion / a woman is cutting green onion / a woman is cutting a / a woman is cutting an onion / a woman is slicing onions with a large knife / a person coking / a woman cuts a large green vegetable into / a woman cuts vegetables / a person slices food / a woman is slicing a leek / a woman is cutting a plant / a woman cuts a long vegetable / a woman is chopping an onion / a lady is boiling something / a woman is slicing a leek / the lady cut up the green onion / a woman demonstrates how to cut a leek / a woman is cutting a large green onion into pieces / a woman is chopping a vegetable / the women is cooking something / the lady cut the green onion / a woman slicing up a / how to make noodle video / a woman is talking about how to make / a girl is cutting some vegetable / the man tasting a bean which is cooked by / a woman is slicing a leek / a woman with a knife is slicing a vegetable / a woman is cutting an onion / a woman is cooking / a women is slicing / a woman is slicing onion / a woman is cutting an onion up / a woman is cutting pieces off of a leek using / the woman is slicing a spring onion / a lady is cutting the vegetable / a woman is cutting a vegetable / the lady sliced a green onion / a woman is slicing an onion into pieces / the woman is slicing a leek / a woman slices fruit / a woman is cutting a leek into slices / a woman is slicing a leek / the women is cutting the something / a woman is slicing onions / the woman is slicing a leek / a lady is cutting something / a person making noodle / a woman is cutting a / the lady the green onion / the lady is cutting the / a lady is cutting vegetable / a woman is slicing a onion / a woman is slicing some vegetables / a man cooking his kichen / someone is preparing something / the woman is slicing / a woman is slicing a onion / a woman is slicing a leek / a woman is cutting a onion / a woman is slicing onion / a woman is cutting a onion / the woman is slicing / describe to make noodles
gyOVZz7kXyM_1_10, a person is playing with a puppy, a cat is being brushed / a men is cleaning the kitten / a man is brushing a cat / a white cat is lying on its back and a / the man is brushing the cats hair / a man is brushing a cat / someone is brushing their cat / a person is brushing a cat / the man is combing the cats hair / the man brushed the white cats stomach / a person is combing a cat hair / a person is brushing a cat / a man is cats hair / a cat is playing / a man brushing hair of a cat / the man brushed the cats stomach / a person is brushing a cat / a man combs a cats belly / a cat is being brushed / someone is brushing a cats hair / a cat is being brushed / a man brushes a cat / a cats fur is being brushed / a woman is combing a cat / the person is doing the / the man brushed the white cat
kKGehSw5ht8_39_45, a woman is singing, a man is his hand forward and it / a man is watching the on his hand / the mans hand is / the man is holding out his hand / a man out his open hand / a man is stretching out his arm and looking at / a hand is shown with its fingers spread and a / movie trailer of of / a man is showing his hand on a golden plate / a man is staring at his hand / is to go along but there are / a man out his hand / a young man is staring at his hand / a man is looking at a on the / a man is lifting his hand / a man is looking at a that is / a man has a on his hand / a man is out his hand / a man out his hand / a man rising his hands with / a man looking at his hand / a shaped light is fall on the mans hand / a man is a strange sign on his / trailer for film of / a man is staring at his hand with his fingers / a man holds his hand out / a man is holding out his hand / a man is gazing intently at his palm against / movie trailer for of / a man is trying to touch / a man his hand / a man holds his hand in the air while staring / a bright shape appears on the hand of a / a man holds his hand out / a man stares at the on his hand / the man is holding out his hand / a man holds his right hand in front of him / a man has his arm and is staring at / trailer of of / a man has a on his hand / a guy is showing his hand
lrZxpneS6Gk_0_12, a man is riding a skateboard, a girl is skating / a girl and her are ice skating / a girl is helping her two ice skate / a little girl takes her skating / a girl ice skating with / a little girl makes her ice skate / a girl is skating with two / a girl is skating with / a girl is skating while holding / a girl is skating with her / a kid is making her skating in ice / a girl is ice skating with her / a small girl is skating on the ice with the / american girls are ice skating / a girl with is skating / a little girl ice skates with her / a girl is skating with her two / skating girl with / a girl is skating on ice with some / a little girl is ice skating with two of her / people are doing ice / a girl skating with her two / a child plays with / a girl skating with / young girl ice skating with her 2 / a girl going skating with pretty / the little girl ice with her / the cute baby is skating / a girl goes ice skating with her / a girl and two go ice skating as she / a little girl is ice skating with her / a baby is walking on the road / a small girl skates to hold two to skate / a girl is ice skating with her / american girl go ice skating / a girl skating / a baby doll is doing scating / the girl with her 2 / a girl is ice skating with her / a is ice skating with her toy / a girl and her doll skating on the ice / a girl ice skating with on the ice roof / a girl is skating / american girl is doing skating / a girl is ice skating with her / a girl skating with her in a skating stadium / a little girl is ice skating while holding two / a girl is skating with two / a young girl and her two ice skating / young girl ice skating with two / a girl is ice skating with two / american girl are going for ice skating / a girl is ice skating with her / a girl play with a toy / a girl is doing ice skating with two / the little girl and her are ice skating / girls doing ice skating / american girl go ice skating
gtixLEvO2Us_0_6, a woman is dancing, the woman is dancing / a woman is dancing while sitting on some steps then / a woman dances while seated on a / a seated girl to be dancing / a girl is dancing in a floor / a girl is dancing / a woman is dancing / a lady is dancing / a woman is dancing / a woman is doing some hand / a woman is dancing on a set of stairs / a girl dancing on the wooden steps / a woman dances alone and then laughs / a woman is dancing / a woman is sitting down and dancing / a girl dances on stairs / a girl practising some kind of unique and funny dance / a girl is dancing / a woman is swinging her arms / a woman is dancing / a woman is sitting in a lit room and / a woman is dancing / a girl is dancing sitting on the steps / a woman sitting on a staircase swings her hands in / a girl is sitting on stairs doing dance moves / a woman is dancing / the girl can do the sit dance / a woman is shaking her body around / a woman is being / a girl shook her body on stage / a girl is dancing / a girl is dancing / a girl is sitting on the steps / a woman is dancing quickly / a girl doing the of dancing / a girl is sitting down and dancing / a young chinese girl with friends having a good time / a female is dancing / a girl is sitting on the steps / a woman is dancing / a woman is dancing / a girl dancing and singing / a woman is dancing on the stairs / a girl is dancing sitting down / a girl is dancing / a woman is playing / a woman is dancing on a set of stairs / a woman is dancing sitting in stairs / the are chatting in a group / a girl sitting and dancing / the girl danced on stage / the girl is dancing / a girl dancing / the girl is playing / a girl is performing stage / a woman is doing some dance steps / a woman dances while sitting on the stairs / a lady is dancing
