klFyrnrUSck_13_19, a woman is slicing a vegetable, the woman is slicing onions / a women cutting onion / showing how to make / a woman slices onions / a person is cooking / a woman cuts onion / a woman is slicing an onion / a woman is slicing an onion / a woman cuts an onion / a woman is cuting onion into / the woman is slicing onions / the women is cutting onion / a woman is slicing an onion / a woman is cutting an onion / the lady sliced an onion / a women is making dish / a woman is slicing an onion / a woman is slicing an onion / a woman is slicing an onion / a woman slices a piece of onion with a knife / a woman is slicing an onion / a woman is slicing a onion / a woman slices onions with a large knife / a video on how to make / an asian woman is thinly slicing onions with her dog / a lady cutting an onion with her dog in the / a woman is cutting an onion / a woman is chopping onions / a woman is slicing onions / a woman is slicing an onion / a short clip about how to make / a woman is cutting an onion / a lady is cutting onion / a girl is cutting an onion / the lady sliced an onion / a woman is chopping an onion / a woman is slicing onion / a woman is chopping an onion
q7pOFn8s4zc_263_273, a man and woman are talking, a couple dancing together / actress is singing / the person is dancing with girl / a lady is singing the with man / a dancing / a man and a woman are slow dancing and talking / the lovers dancing with love song the girl sings the / a couple slow dances / two people are slow dancing / a man and woman are dancing / man and women to gather dance / a man and woman are dancing / a man and a woman dance / a man and woman dancing / a man and a woman slow dance / this is a song of lovers / a hero and the heroine is dancing for the song / the are dancing / and doing each other / its a scene from south indian tamil movie / a lovers are singing and dancing to the songs / a couple are dancing / a man and a woman are dancing / a man and a woman slow dance together / this is the scene of south indian movie / a movie scene from the bollywood movie / a couple dances / a lady is singing / a man and a woman are holding each other and / a man and woman dancing / a man and woman are slowly dancing / a couple is dancing / a man and woman are dancing / a couples are performing song sequence in movie / couple slow dancing singing to each other / a couple is slow dancing / indian movie trailer with oru / a couple are dancing / a man and a woman dance together / a man and a woman are slow dancing / the man and lady danced in the church / a man and a woman are dancing / a man and woman are dancing / a man and woman are slow dancing / one couple singing a song during dance / a man and woman are shown dancing together in an / a man and a woman are slow dancing / a cuple dancing their / the couple danced in the church / a man and woman are slow dancing / a couple are dancing / a man and a woman dance slowly in a / a man and woman is dancing
m7x8uIdg2XU_67_73, a woman is adding oil to a bowl, the woman is pouring cream over the pasta / someone is pouring sauce on pasta / a woman is pouring milk into a bowl of uncooked / a woman is pouring a white liquid into a bowl / a woman is pouring sauce over noodles / a woman is adding milk to some pasta / milk being poured to a bowl of pasta / a woman is pouring ingredients into a bowl / the person is cooking the something / a woman is pouring some milk onto noodles / a woman is pouring sauce on pasta / a woman is pouring milk over pasta in a bowl / a person adds ingredients to pasta / the girls are doing the cooking / the woman is pouring liquid over the pasta / a woman is pouring milk into pasta / the lady poured the sauce over the cooked noodles / a person is pouring sauce into a bowl of noodles / a woman is pouring milk onto some pasta / a woman is adding sauce to a bowl of pasta / the womans are preparing the item / a woman is adding something to a bowl / someone pours a looking substance from a measuring cup / a person pours milk onto some noodles / the girls are mixing the milk / the lady added a cream sauce to the pasta / women are cooking her kichen / a woman is pouring milk into a bowl
nBFhvrAOFqY_23_29, a woman is driving a car, the monkey rode the bus / the chimpanzee rode the bus / a monkey is having a ride in a vehicle seated / a chimpanzee travelling in a bus in style / an orangutan is riding in a bus / a monkey is riding inside a bus / a monkey rides the bus / an orangutan is riding a bus / the monkey is seeing the something / a monkey is riding on a bus / a monkey wearing headphones is riding the bus / a monkey is riding a bus / the monkey is on the bus listening music and / a monkey is riding on a bus / a monkey is riding a bus / a monkey rides the bus / a monkey is traveling / a monkey is sitting on a moving bus / a monkey is riding on a bus / the monkey is riding on a bus / a monkey in a tshirt is riding on a city / a monkey is sitting in the car / a monkey is riding a bus / a monkey is sitting in a car / a monkey is traveling on the bus / a monkey is riding a bus / a monkey wearing headphones is a passenger on a bus / a monkey is riding a bus / the rode the bus / in th bus / a monkey rides on the bus / an orangutan is riding a bus / a monkey traveling in bus / an orangutan is riding a bus / a monkey is riding in the car / the monkey is listening with his / a monkey with head phone
jvxUeT1Nlb8_100_115, someone is cooking eggs, a beaten egg is being poured into a pan to / a demo showing the of a stick cooking / the girl is cooking / when the pan is hot egg is being poured into / someone cooks an egg in a frying pan / a woman is making a egg fry / a person is cooking / someone is cooking an egg omelet in a skillet / a woman making omelette or omelet / scrambled eggs are being cooked in a wok / a woman is making liquid egg to fry / somebody is making / someone is frying egg mixture / someone pours beaten eggs into a pan then turns off / in video a man is making in the pan / a woman is making omelet / a person is making an omelette / a person cooks eggs in a pan / a woman makes an omelet / a pancake has been cooked in the frying pan / a person is frying / an omelette is lifted off a frying pan / a cook fries an egg in a pan / making / eggs are being fried and made into a snack / a person cooking egg / the person just cooked a omelet on a cooking / eggs being cooked in a pan / the chef is preparing / the person is cooking an egg / a girl making egg omelet / a person cock in egg / a woman is cooking eggs in a cooking pan / a person is preparing omelet / crepes are being made / it is how to make an / a women is preparing egg / a lady is preparing omelet / an individual is cooking an egg in a pan / a person cooks eggs
kBjUDCyDCuI_20_26, a man is shooting a gun, two men shooting out in the woods / a man fires a gun in a shooting range / a man is shooting a gun / a man fires several rounds using an automatic weapon / a man shooting the target with gun / a man firing a weapon / a man is shooting with an gun / a man is shooting an automatic pistol / a man shot an automatic gun at a target / a man is firing a gun / a man is doing firing randomly / a man is shooting a gun / a shooter shoots rapidly many rounds / a man is shooting with his gun / a man shoots a automatic / a man firing an automatic rifle / a man is shooting with the gun / a man is firing some type of on full / a man is rapidly firing his / a man is shooting / a man is firing / a man is firing an automatic pistol / the man shot an automatic pistol / a man is firing an automatic weapon / a man shoots a gun / a man is making gun shot / a man shoots a gun on full / a man firing with a gun / the man is shooting / a man is shooting on his pistol / the man is shooting a machine gun / a man is shooting with his gun / a man with a small gun / a man is shooting a gun / a man is shooting / a man is shooting a gun / a man standing in an outdoor location fires a good / a man is shooting a gun / some people shooting / a man is firing a pistol is full / a man is shooting off a gun / a man is shooting / a man shooting using guns / a man shooting with gun / a man firing bullets through an automatic pistol / a man is shooting a machine gun / a man is firing a gun outside / the person is shooting the something / a man shoots an automatic gun / a man shoots off a round of bullets from his / a man is firing a gun / a man is shooting something / a man is shooting a gun / a man shooting a gun / a man rapidly fires a gun / being fired at rounds by various men at / a man is shooting a gun / a man is shooting an looking gun
klteYv1Uv9A_27_33, a man is riding a motorcycle, a man is driving bike in amazing style / a man riding the byke / someone is riding a motorcycle / the man riding the bicycle with the road / the man is on his back riding a motorcycle / someone riding a bike / a guy is laying on a motorcycle / a man is laying down on a motorcycle / a man rides a motor scooter in an way / the person is doing feat on bike / a man is laying down while riding his motorcycle / a man is riding a motorcycle / a man riding bike / a person is riding the bick with legs / a man is riding a motorcycle with no hands / a man is riding a motorcycle while lying back / a man is riding a motorcycle without holding onto the / this video is a man on / a man is riding a motorcycle / the man is doing motorcycle tricks / a man and talks on a phone while / a man laying down is riding a motorcycle / a man is doing motor bike stunts / a man is riding a motorcycle while laying down / the man on his motorcycle as it moved down / the man laid back on his motorcycle as it traveled / a guy is riding a / a man is lying back on a moving motorcycle
ibSwITK4jjQ_14_24, a man is driving a car, a aiming a gun a white car / a police man is on car / a police / cop is a car / a police is pointing his gun at a stopped / the police pulled over the car and drew his / a car is going on the road / a police pulls out a guns and takes aim / a police is yelling and pulling a woman from / police man scaring with other person / a cop is pulling someone over / a police is rounding up a car / the police men is showing the gun in front of / a police holds a gun in the air ready / a police is approaching a vehicle with his pistol / police is checking car / a pulls a gun on someone / mad police holding a gun on a driver / a police is / a searching a car / covering a car standing on the of an / a police man is someone over on the side / the pulled a gun on the driver he pulled / a police pulls a car over / many cars are running on the road / a police is shooting on the road / a is trying to check someone car / a cop is pulling a gun on a person who / an police approaches a stopped vehicle / the car was parked beside the road / the person is shooting the car / a police is trying to the person in car / a is stopping a car / a man is chasing a car / an has drawn their gun at a / a cop is pointing a gun at someone / driving the car / a cop is stopping the car / a approaches a parked car with his gun drawn / a police pulls a gun on a driver / a police points the gun at a white car / a is pointing gun towards passenger / a police with gun drawn is walking towards a / a police approaches a pulled over vehicle / one showing his gun to / a police is pulling over a car on a / police / a cop pulls a gun on a person in a / the pulled a gun on the car he had / a cop is trying to a car driver / a police man is shouting and pointing a gun to / a police moves toward a car with his gun
hFERWnoc-nU_0_12, a man is talking on the phone, a woman is talking / a woman is being interviewed / the man interviewed the soldier / a man taking an interview of a woman / the man is a woman / a girl is speaking with a man / an lady is talking to the man / a man is a soldier / a man is a woman / a man is speaking to a woman / two people are talking / a man with a is talking to a / a woman and man are talking / a person is talking / a woman is talking to a reporter / a man and a woman talk / a man is talking to a woman and recording what / im not clear about what you are asking / a man is a woman / a man holds a up to a womans mouth / a woman is giving speech / the person is taking interview / a man is a woman / a woman is giving an interview / a woman is talking to a reporter / a man a lady / a woman is giving interview to a man / a man a woman / a woman is doing an interview / a man is a woman / they are talking / the reporter interviewed a soldier
vRC9sBNt9vs_10_16, two animals are playing, thr person is playing with frog / a man is holding a frog in his hand / a man is holding a frog / a man is holding a frog / a purple frog held by a man in his hands / a man holds a small frog / the man picked up the frog in his hands / a small purple frog in hand / a man is catching a frog / a person holds a frog / a man is holding an / someone holds a toad / a man is holding a frog / a man is holding frog in his hands / a man is holding a frog / the man is holding a frog / a frog crawls along a mans arm / a man is holding a frog / a man holds a frog in his hand / the man is in the forest / a man is holding a frog / a man is holding a frog / a woman is a frog / the man is holding a frog / a man is holding a frog / a man is holding a small frog / a man is holding a frog / the man held a frog in his hand / it looks like a really cute walking that
ok4cM6WTA5E_120_133, a person pours water into a pot, a person poring red sauce / someone is pouring sauce into a pan / a man preparing sauce / a man is pouring tomato sauce into a large pot / someone pours tomato sauce from one pan to another / a man is pouring a sauce from one pan into / pasta sauce is being poured from a small pot into / the man poured the tomatoe sauce into a bigger pan / a person pours a red sauce from one pot into / a man pours sauce from one pot into a larger / a person is pouring tomato sauce into a larger pan / lazy mans / a man is preparing to make a dish named / a man pours some sauce into a pot / a person is pouring a tomato mixture into a larger / a man is pouring spaghetti sauce from one pot into / the man is pouring sauce in to the cooker / a man some in the pan / a sauce is poured from one pan into a larger / pasta sauce is being poured into a pot / a man pours tomato sauce in a pot / a person is pouring the into the pot / an individual pours a sauce from one pot into another / a man pours sauce into a pan / someone is pouring sauce into a pot / a man pours a large of tomatoes from / a chef cooking food / a man cooking some sort of unique recipe but / food is poured into a bowl / jack prepare the delicious food and demonstrate / someone pours a pot of tomato sauce into a larger / a man is pouring some dish from one bowl to / someone is pouring tomato sauce from a pan into a / a man is pouring sauce into a pan / a video on lazy mans / a person is pouring sauce from one pan into another / any one is making / the man is pouring sauce into the pot / the person is explaining something / sauce is being poured into a pot / the lady poured a tomatoe sauce into a bigger pan / a man cooking his kichen / the person is cooking something / a man is cooking something / a person is pouring a red sauce from one pot
inLBPVG8oEU_18_24, a man is playing a video routine, the man is dancing / a man is dancing / a man is dancing on a stage / a man is dancing on a stage / a man dancing / a young man is dancing alone / a man is dancing on a stage / a man is dancing on a stage / he is in of dancing / a man dances on a stage / a man is dancing on stage / a person is dancing / a man is dancing on the floor / a man dances in the / a man is dancing / a man is dancing on a stage / a man is dancing / a man is dancing / a men is dancing / a man is dancing / a man is dancing / a man is dancing / a man dances / a man is dancing on a stage / a man is dancing / a man is dancing / the man is dancing / a man is dancing on stage / a man is dancing / i the old of dance because now he / a man dancing / a man is dancing / he is dancing on the song / the man tap danced on the stage / a man is dancing / a man is dancing on a stage / the man tap danced a fast dance / a man is dancing on a stage / the man tap danced on the stage / a man is dancing on stage
j2Dhf-xFUxU_20_29, a person is slicing a pepper, a chef slicing a tomato / the person is cutting the tomato / any one is slicing tomato / a person is slicing a tomato / someone cutting the slices of / a tomato is sliced with a knife / the cook is slicing tomatoes / a person is slicing a tomato / someone wearing blue rubber is slicing a tomato with / someone is slicing a tomato with a knife / a person is slicing a tomato / someone is slicing a tomato / a person is cutting a tomato / a woman is slicing tomato / a person is slicing tomatoes with a large knife / the person is slicing tomatoes / a person is slicing some tomato with knife / someone is cutting a tomato / someone is slicing a tomato / a person is slicing a tomato into pieces / the man sliced the tomatoe / the man sliced the tomatoe / slice the tomato pieces / the person is cutting the / the man sliced through the tomatoe / a chef is slicing a tomato / a person is making the salad / a cook cuts up some / someone is slicing a tomatoe / a person is slicing the tomato / a person slices a tomato / the person is cutting the tomato / a person is slicing a tomato / someone is slicing a tomato
psXeA8sSYdI_25_30, a girl is riding a tricycle, a young girl smiles as she by on her / a little girl is riding cycle / the girl is riding a scooter / kids are riding tricycle / two little girls are riding / a girl is riding a scooter / a cute small girl driving a bicycle / a little girl is riding on a scooter / a girl is riding on a tricycle / the little girl rode her scooter / three cute babies were playing in the outdoor / a girl is riding a scooter / girls riding outside / a girl is riding a scooter outside / a girl is riding a scooter / a little girl rides her scooter up the driveway / a baby girl is playing with her tricycle / the girls are practicing in their field of / kids were playing outside / little kids playing outside on their and / small and cute kids playing outside the house in the / a little girl plays on her scooter / a little girl playing outside / a small girl is riding a scooter on the / the kids are playing outside / a girl is riding a scooter / kids playing in they ground / three kids with their toys playing outside / the little girls are playing / a little girl is riding a pink scooter / a young girl is riding a pink push scooter / a toddler rides her scooter / kids playing with / kids are playing outside / a little girl a scooter / a child is riding a scooter / kids playing on a road / a small girl is pushing the tricycle / three little girls riding a bicycle / kids are playing riding / a group of babies are playing / kids are playing / a girl is riding a scooter outside / the little girl is riding her scooter / a girl is riding a scooter / a small girl is scating / kids playing outside / a little girl rides a scooter / a little girl is riding her pink scooter / a girl is riding a scooter / two girls riding / a young girl is riding her scooter
jW77z3-SrO4_56_63, a person is mixing flour in a bowl, somebody is mixing the of an egg with flour / an egg is added to the flour and / a lady is cutting an egg into a flour and / a woman is mixing a into a dough mixture / a woman is mixing an egg into her dry ingredients / cook ready in wheat / a woman is making dough / a women cocking wheat / a woman mixes an egg and flour / in video flour is been mixed with / the lady is mixing the flour with the help of / a woman is mixing cream with some food powder / mixing egg into the flour / a woman is mixing an egg with some flour using / the person is mixing eggs with flour / a woman is mixing ingredients / an egg is being mixed with flour and butter / eggs butter and egg is being mixed on a cutting / a lady is mixing the egg in the flour / flour egg and butter are being mixed together / a woman is cutting an egg into a pile / a woman is mixing egg in flour / a woman mixes an egg into a pile of flour / a woman is mixing gel and flour / a lady is mixing with egg / a person is mixing eggs into the flour / a women is mixing egg in the flour / a woman making some recipe / a lady is preparing dough / a lady preparing some dish / a person mixing egg in to floor / an egg gets mixed into flour and butter / a cook prepares the dough for a delicious looking cake / a woman is mixing some egg with flour / mixing up the flour / flour is getting prepared for making pastry / a woman adds orange paste to flour
rq2p5ML8-WI_63_69, a man and woman are dancing, going a wedding party in a movie scene / a man ties the thread around the neck of / the man put a on the lady during a / a man is putting a on a woman / a man put a around a womans neck / the man put a around a womans neck during / a man puts a on a woman / a man puts a on a woman / a woman is wearing a wedding by her / people enjoying the marriage / a man is placing an object around a womans neck / a couple of marriage / a man puts a on a woman / two people are getting / a man puts a on a woman / super acting hero and / a man puts a on a woman / the man and woman got / the man and woman got / a couple are getting / someone is putting a on a girl / someone is putting a on a girl / a man puts a on a woman / the man put a on a lady in a / a girl and boy is laughing / a man puts a around a womans neck and / a man is a woman / a man is putting a on a woman / a man and woman are sitting side by side and / a man is a woman / a scene from an asian film / a man put a on a woman / a man places a chain around a womans neck / a man is woman is getting / a group of people / a man is doing marriage / a man puts a on a woman
yd8jh9QYfEs_4_10, a man is driving a car, women are leaving a / a group of women get out of a / a woman is getting out of a / the person is doing the something / girls are coming out from the car / some women are getting out of a / a woman gets out of a / women are a / women a / very cute and sexy girls / women are walking out of a car / a girl getting out of the car / a woman is getting out of a / girls are getting down from the / a hot come out from car / the women got out of the / women are leaving the backseat of a / women a / the girl got out of the / a lady is getting out from the car / a girl gets out of a / women are getting out of a / a group of girls are a / women are a / two women get out of a / the girl got out of the / the women got out of the / a woman gets out of a / they are going / the person is getting the car / a woman gets out of a / two woman are getting out of a / a woman wearing dark glasses and a short black dress / a woman getting out a / a girl is opening a door / a video clip of leaving a
z0zb--BOhDY_16_22, a man is cutting a cover, a mid man making food in shop / a man is making / a man is making / chef is making in the selling to / a man is rolling dough into / a man is rolling up strips of dough / the man is rolling out pastries / man is rolling dough / the man rolled out the dough / a man is rolling dough / the man is making donuts / a man in a shop showing how are / a baker kneads some dough / a man is making donuts / dough is being prepared / an indian man is rolling some dough / a man is rolling dough to make / the man is rolling dough / a man is rolling dough / a man is making dough into small ring pieces / a man is making roti / a man is rolling dough for / clip of a restaurant where a chef tring to prepare / a man prepares dough / a man baking donuts / a men cooking his kichen / a man is making raw out of dough and / on and / a man is working dough / a man is rolling dough / people are making in a traditional and people / a man is preparing some cookies / a man is rolling out dough / a man is rolling dough / a man is preparing in a / a man rolled dough / a person is making something with a meal / the baker is rolling dough / people making in the / a person is making donuts / a man is making circle from flour / a person is kneading dough / a man working with dough / a man is preparing dough at a shop / a man making / a man is making some food
