uVPnDJKt1M0_0_6, a car is moving on the road, the car going very fast / a man is traveling on a car / a car is moving in a field / a car is driving / hindi movie actor in a bollywood movie sequence / a car moving on a grass / a scene from a movie named and / a couples are on the boat / a car travelling over a mountain seems to be / a car is driven / a car is / the car drove down the dirt road / someone is driving a car in the desert / a child is driving a car / they are enjoying the music / someone is driving a car / a drunken car drives by a child / someone is driving a car / a car is going downhill / a car is running / a car is being driven / a car is driving / a person driving a car / a is driving a car / a car driving on the open place / an individual drives a car that has the steering wheel / a car being driven / a man is driving a car / a car drives over a hill / an old car drives over / a man is driving car / the car bounced around in the dirt / it is scene from south indian tamil movie / a car drives over a hill / a car is being driven on grass / a car is driving up / man is driving a car / a car is driving / a car is being driven / the man is driving a car / a person is driving a white car with another person / a car is moving / a couple is sailing in the boat / the person is the car driving / a small light colored car as it drives / a car is going down a hill / a boy driving a car / the white car is moving / a car is running on the ground / a car is coming up over the / some person driving the car / an older white car is driving across a dirt surface / a white car is driven over a / a car driving on a region / a car is driving / a man is driving car / a car is runing / three people out on a road trip / a person is driving a car over a dirt hill
lb8J2zCQTlo_3_8, a man is cutting meat, someone is cutting meat / the man cutting the big piece of meat into small / a person is cutting some meat / fat is cut off a section of meat / a person is cutting meat / someone is slicing a slab of meat / a person is meat / a man is slicing the meat / someone cutting something with knife / a man is cutting the meat with a knife / a person is slicing some meat / a man is trimming fat from a roast / someone is slicing small pieces of meat off of a / a men is cuting the chiken / someone sliced off the fat from the meat / a man is cutting meat / chopping up meat to prepare a yummy dish / a man cutting some kind of meat for the meal / a person is cutting the fat off of a piece / a person cutting raw meat / fat is being off meat / a person is cutting strips off a piece of meat / a person is cutting meat / the person is cutting / someone is slicing a large piece of raw meat / a man slices meat / a chef is cutting a chicken into rounds / a man is cutting meat / a man trims a big of beef / a chef slices a slab of meat / a man is cutting up a piece of meat / top layer of a meat is / a piece of meat is being cut into sections / a person is cutting meat / someone is slicing meet / a person is cutting meat / a person is slicing meat with a knife / a person is slicing strips of meat with a long / a man is slicing the meat / the man is slicing thin strips of beef / someone is slicing small pieces of meat off a large / using a knife a man chops thin slices from the / a person is cutting meat with a knife / a person cuts a large piece of meat / the man is showing how to cut a beef / a man is cutting the meat / is slicing meat / fat is being cut off of meat / a man cuting meat / a man is cutting a / someone is cutting a piece of meat / someone a piece of meat / a man is cutting meat
rVFJzN20jhQ_27_32, a man is doing exercise, someone hits a boy with a / the boy is talking the another / in the two person one is hit the other person / they are fighting / is hitting a boy with a flower pot / the man hit the boy with a / a man breaks a on a boys head / a man smashes a over a boys head / a man is breaking a on a boys head / a man is saying something / a man is hitting a boy with flower / a man smashes a flower pot on a boys head / a man breaking a dish over a boy head / the man and threw a at his son / a man is breaking a on a teenage boys / a man yells at and hits a boy / a man breaks a over a boys head / a man breaks a over a boys head / john throwing a flower on a boy / the got angry at his son and threw a / the man used a to hit the other man / a man throw the flower against the boy / a man hits a boy on the head with a / the clip the movie clip movie is so beautiful / a man smashes a flower pot on a boys head / the no to his son and threw a / a man breaks a on a kids head
t4aPGtx7e6k_0_10, a monkey is pulling a dogs tail, crazy monkey teasing a dog / a monkey is teasing a dog / a monkey is pulling dogs tail / the monkey is playing with dog / a monkey is holding the dogs tail / a monkey is a dog / a monkey is playing with dog / a money is pulling a dogs talk and leg / a monkey is playing /  / a monkey pulling on a dogs tail and running away / a monkey is playing with dog / very funny monkey and dog video / a monkey is teasing a dog / a monkey is playing with dog / the dog pulled the dogs tail and then his leg / a monkey pulls a dogs tail and is chased by / monkey / a monkey pulls on a dogs tail / a monkey is playing with a dog / a money and a dog fighting / a monkey is pulling a dogs tail / the dog pulled the tail and leg / a monkey keeps grabbing a dog / a monkey is teasing a dog / the monkey grabbed the dogs tail and leg / a monkey grabs a dog and then runs from it / a monkey pulls a dogs tail / a monkey pulls a dogs tail / a grabs a dogs tail / a dog attacks a monkey / a monkey pulls a dogs tale and runs away / a monkey a dog / the monkey pulled the tail and leg of the dog / a monkey is pulling the dog tail / a monkey pulls a dogs tail / a monkey pulled a dogs tail
fKqBnl8D1Qo_5_44, a man is singing, people dance using hand /  / the group of people are dancing / people are performing on a stage / the actors are / a lady is dancing / a dance is being performed / the person is dancing / two people are acting on a stage / a man dances in costume / a woman and man are performing an indian dance / a form of indian classical dance / doing / indian artist perform traditional dance / three people perform a / she is dancing on the stage / a woman and another person in costumes are dancing / the person is dancing / a woman is dancing / a woman is dancing with her hands / a person is dancing / a is showing on the stage / two people in costume are performing on stage / people are dancing / people in costumes are putting on a performance / people are acting on a stage / artists are performing / an indian woman does tricks with her hands / a woman and a man are playing a drama on / a woman is dancing / the actor danced before king / the woman is dancing / the woman is dancing / a woman is dancing / very very super dancers for dance / the men are dancing / dancers is presenting show / the dancer performed for the king / actors perform in a / show at / two people are putting on a play / people in costumes do hand / they are dancing the traditional dance of / two costumed people are dancing
x68Djm_Q0GA_0_10, a man and woman are riding a motorcycle, a couple is riding on motorcycle / the boy is riding the bike with the girl / a couple is riding a bike / a young man and a young girl on a / a man was driving a woman on a motorcycle / two persons on bike something / a man and a woman riding on a motorcycle / a man and a women riding on a bike / the couple is riding a motorbike / a man and a woman are while riding a / the man about the at home and the / a young couple while driving a bike on the / a man and a woman is riding on a bike / in / surya and were talking while going in a motorcycle / a man and a woman are riding on a / a man and woman talk while riding a motor scooter / a man and a woman are talking while riding a / surya and were talking each other / guy and a girl traveling in a bike / a man and a woman are riding a motorcycle in / a man is talking to his female passenger on a / a man and woman is riding a motorcycle / a man and woman are talking while riding a scooter / a man and a woman are riding a motorcycle and / a man and woman riding a motorcycle down a / surya is going with his / a man and woman are riding in a motor bike / a woman is talking with a man while traveling in / surya is his love on a tamil film / a man and woman riding a scooter / a actor riding a bike with a heroine in a / in / a man and women riding on the bike / a man rides his girl on a motor bike / a man and a woman are riding a motorcycle / a boy and girl riding on the bike / two people are riding a scooter down the road / a man and a woman ride down the street on / a couple are riding on a motorcycle / a couple going on bike / a couple are riding a motor scooter down the street / a man and woman are speaking while riding a motorcycle / the man drove a girl on a motorcycle / a man and a woman are riding a motorcycle / a man is riding a bike and talking to the / a couple is going in bike / a man is riding a motorcycle with a woman riding / a bollywood movie scene of an actor and actress riding / a man and woman are riding on a motorcycle / a man and a woman are having a conversation on / a man and woman are riding a motorcycle in traffic / two people are riding a mopad / a cuple walking on the bike / a man and woman ride a motorcycle / two people are riding a moped and talking / a couple is walking in bike / a couple bikes on a road
ri5AyXzxb4o_201_215, a man is shooting, a man is standing in the forest / a man is shooting with his gun / a man is shooting at targets with a handgun / a man shooting a pistol at targets / a man holding a gun is firing bullets at a / a man is firing a gun at targets outside / a man is taking target practice in the woods / a man shoots at targets / a man shoots a gun / a man shoots a pistol several times / a man is firing a handgun / a man doing some sort of shooting practise in a / the person is shooting with gun / a man is shooting / a man is firing a gun at a target / an individual in the woods aims at a target / a person targets / a man is shooting a pistol / a man taking shooting practice / a man is aiming to shoot / a man firing the gun / a man shooting in shooting range / a man practicing shooting / the shoot with gun / a men shoot their / man firing with a pistol in a firing range / someone shot a gun at a target / a man is shooting with a gun / a person with his gun / a man is firing a pistol at targets in the / a man is shooting targets with a gun / a man shot at a target / a man firing at targets in the woods / a man is learning how to shoot / a man target shoots in the forest / he is shooting / a man is shooting a gun at targets / a man is firing a pistol at targets / a man is shooting / a man is shooting / a man is at his targets / a man shooting with pistol / a man shooting / a man is shooting at targets with a handgun / a man is shooting at a target / a man is shooting a gun at targets / an old man is standing / a man is shooting at a target range / a man is shooting a gun / a man is shooting a gun / the man is shooting a gun at targets / a man fires a gun / a man is shooting a pistol at targets
pcjuCotJYj8_50_62, a man and woman are fighting, a woman is rowing a boat in a flooded area / a woman is rowing a boat through flooded streets / a reporter is paddling a canoe in water and reporting / a woman is being as she down a / a woman is rowing a boat in the street / a woman is rowing in a boat talking on a / a tv reporter does her from a canoe / of walking i think paddle / a female reporter while in a canoe / a woman is rowing a boat / a woman is rowing a boat in a flooded area / the lady is in a canoe / the woman reporter is reporting about / a newscaster is paddling in a boat / a lady is a on water / a woman is paddling a boat / the woman is paddling a canoe / a news reporter is rowing a canoe down the street / a woman is rowing a boat in a water flooded / a lady is riding a boat / a lady a boat in the flood waters / a man reading news in the channel / girl boating to get across the flood / a woman is sailing a boat / a lady a boat in the flooded street / a woman is in shallow water / a woman rowing a boat in a flooded / various youtube videos showing things like weather and / a woman is paddling a canoe in very low water / a tv channel show flood area / a reporter is paddling a canoe down a flooded street / a woman is sailing the boat in the river / a woman is rowing a boat / a woman is paddling a along a flooded street / a woman is rowing a boat / a lady paddling a canoe in / awesome tv bloopers / a woman is doing boating / a woman rowing a boat on the street as it / a woman is paddling a canoe in shallow water / men came small / a woman is in a boat / the woman is rowing a canoe / a man is boating in the water / an tv bloopers show / a woman is rowing in a green canoe down a / one of the tv channel news at / a woman is paddling a canoe / a woman paddles a canoe through very shallow water / a woman is in a flood
ok4cM6WTA5E_142_150, a man cooking his kichen, a person dumps a plate of shredded cheese into a / a lady is making a dish / a person is adding shredded cheese to a cooking pot / someone is putting cheese into a pot / a person puts pasta in some water / cheese melting in hot sauce / the lady added cheese to the sauce / frying the vegetables / a man is making / a person is adding shredded cheese to a pot / in the process of preparing a / a man is scooping pasta from a plate into a / a man is making / a person is cooking / a person puts shredded cheese into a pot / a man is putting cheese into a pan with sauce / a person is pouring cheese into a pot of red / someone is pouring cheese in a pot / a man is adding shredded cheese to a pot / the cook is adding cheese into the pot / a woman is putting cheese into some sauce / someone is putting cheese into pasta sauce / someone is putting cheese into a pan of sauce / very good making for video / a man is adding something to a pan / the man is cooking / the lady added cheese to the tomatoe sauce / a man adds a plate full of grated cheese to / a man cooking food / a man is dumping cheese into a pot of tomato / a chef pours shredded into a sauce pan / the man is dropping cheese into the pot / a man is cooking / a man is adding cheese to a sauce / how to prepare / the person is the cooking the noodles / a man pours a plate of shredded cheese into a / a person is adding rice in the bowl / grated cheese is added to the sauce / a person is putting shredded cheese in a pot / a man cooking his kichen
vloe_60s_dk_0_9, a man is shooting, someone is shooting with the gun / a man is firing a shotgun and you can see / he is shooting gun in motion / someone is shooting a gun / a man is shooting from gun / the man shot his gun in the air / a person shoots a gun in slow motion / a man is shooting / a person shooting their / a man is firing with a gun / the person is shooting with a gun / a man is firing a gun / slow motion of bullet coming out from a gun / using a shotgun / in slow motion / the person is the shooting / shooting a gun / he is gun shooting / a man is firing a shotgun in slow motion / the gun fire demo / a man shoots a gun / a man shoots a shotgun / a man shoots a shotgun / a guy is shooting a gun / a is fired from a shotgun in slow motion / a man is shooting with a gun / a gun fires a blast / a shotgun is being shot off in slow motion / shotgun in motion / the man is shooting a gun / a bullet is fired from a shotgun / a man is shooting / a man shot with his gun / of shotgun / a man is shooting a gun / a man is shooting off a gun / someone is firing a gun / a person is a shotgun / one boy is shoot for gun / a man is shooting a shotgun / a man is shooting with a gun / a man is shooting a gun / someone fires a gun / a man fires a rifle / the man shot his gun / a man is shooting / a man fires a rifle / a man shooting a gun / a man is showing the shotgun / the man shot his gun / a shot gun firing in a very slow motion
n6U-TGahwvs_100_110, a man is playing guitar, the persons are making music / a band of artist performing / people are singing / a man is singing and playing the guitar on stage / a band is performing a song / the men are singing and playing guitars / a band is playing on a stage / a band is singing / a band is playing music / two men playing guitars are singing into microphones / two men are playing guitars and singing / a band is playing onstage / two men are playing the guitar / boys are playing guttier / a man is singing / a band plays / the band performed on stage / a band is playing a song / a band is playing music / some black men singing a song and playing guitars / the man is singing and playing the guitar / a black man plays guitar and sings / a band is performing on a stage / two men are singing and playing guitars / a man singing a song / two men are playing guitars and singing / a person is playing a guitar on stage / the man is singing and playing the electric guitar / bob is singing and playing the guitar / a band is performing / a man is singing while playing the guitar / the man is singing / the two persons are sing and play the guitor the / bob playing and singing the song stir it up / two men are singing and playing guitar / the group of people were singing / a musical group giving their performance / some men is singing song / a guy sings and plays guitar / men are playing musical instruments / a boys are singing / two men are playing guitar / a band is playing on stage / the men performed on stage / some persons are playing music / a band is performing on stage / bob performs a song on a stage / a band is playing in a studio
fIaLVw_Gc_w_99_109, a girl is eating, a woman is making an eyeshadow / a woman is applying makeup to her eyelids / a woman is doing make up on her eye lid / a girl applied eye makeup with a brush / a woman is applying makeup to her eyelids / applying pretty green eye makeup / a woman is applying eye shadow / the woman is putting on blue eye shadow / a girl is putting on eye shadow / a woman is applying eye liner / a woman is putting on eyeshadow / a woman is applying blue to her / the lady is putting on makeup / a woman is on eyeshadow / an women make up her eye / a woman is / a woman is applying eye makeup / a woman is putting on eye shadow / a girl doing some sort of makeup above her eyes / of eyes / a woman is doing a eye makeup / a woman applies eye shadow to her / a women is her eye / a woman is putting makeup / a woman is applying eyeshadow on the inner side / a lady is applying eyeshadow on her / the woman is putting on eye makeup / a woman is applying eyeshadow / a woman is applying on her eyes / a woman is applying eye makeup / a girl applied green eye shadow with a brush / a woman is applying blue eye shadow to the inside / the girl is applying eye makeup / a girl is applying eyeshadow / a woman applies blue eyeshadow / a woman puts makeup on / a woman putting eye makeup with a pencil / a woman is her eye / a woman applying eye on her eye / a woman is putting on eye makeup / a woman is applying eyeshadow to her eyelids / a girl is applying eye shadow / a girl is putting eye shadow / a woman is doing eye makeup / a woman is on some green eye shadow / a woman is applying eye makeup / a woman applying eye shadow / a woman applies eye shadow / a young spanish lady demonstrating how to apply various types / a woman is applying green eyeshadow on her / a woman is putting on green eyeshadow / a woman is applying eye makeup / a woman is applying eye / a girl is applying eye shadow on her left / a woman is applying eyelashes / green makeup is being applied to a with / a girl is using a eye shadow on her eyes
xxHx6s_DbUo_158_161, a man is running, the lady fed some food to the man / a woman is a man / a man is eating / a woman is feeding a man / a woman feeds a man / a woman is feeding a man / a woman is feeding a man / a girl is giving food to his brother / a woman feeding a man / one person is eating / a woman is feeding a man / a woman feeds a man / a woman gives a man some food / a lady serving the food to a boy in a / the boy and girl is talking / the woman is feeding the man / an actress is feeding the actor in the film sequence / a woman feeds food to a man / a woman is feeding a man food / the lady fed some food to the man / the woman is feeding the man / a woman a man / a woman feeds a man seated beside her on a / a woman feeding a man / a woman is feeding a man / a woman is feeding a man / a woman is feeding a man / good song i what to / movie dance practicing yoga / the woman fed the man some food / a woman feeds a man with her fingers and the / she is putting to a guy
v-9Gx0gJmfo_26_32, the person is doing the something, the lady swam in the ocean / a woman is swimming / the woman is swimming under water / a woman is swimming underwater / a woman is swimming underwater / a girl is searching / a girl is swimming / a girl is swiming into the water / the woman is swimming under water / a woman swims underwater / a woman swims / she is doing the swimming / a woman is swimming / a woman is swimming / a woman is swimming / someone is swimming / a woman is swimming underwater / a woman swims under water / a girl swimming / a woman is swimming / the girl swam in the ocean / a woman is swimming under water / a woman is swimming underwater / a woman is swimming underwater / a heroine is swimming for a song sequence / a woman swims underwater / a woman is swimming under the water
ptHkvYrH9fY_2_10, a man is playing a flute, a man is playing an instrument / a man is playing a wooden flute / a man playing a wooden flute / the boy is playing the flute / the man is playing the wooden flute / a man is playing a flute / a guy is playing flute / a man is playing flute / a boy playing flute and enjoying it by the deep / a man is playing a flute / a man is playing the flute / a man is playing a flute / boy playing flute / one man playing flute / a man of indian song from hero on / a man is playing a flute / a man is playing the flute / a young man is playing flute / a man is playing a flute / the man played his wooden flute / a boy is playing a flute / a man is playing a flute / a man is playing the flute / a man is shown playing a wooden flute / a boy playing a flute / a man is playing the flute / a boy plays a wooden flute / a man playing music / he is music / a man is playing a flute / a young man is playing a wooden flute / a boy is playing a flute / a man plays a wooden flute / a man plays a wooden flute / the man played his wooden flute / a man playing flute / he is playing the flute / a man is playing a flute / a man plays a flute / a man is playing a flute / a man plays flute / a man playing a flute / a man playing a flute / a man is playing / a man is playing the flute / the boy is playing flute / flute hero old indian movie / a man is playing a flute / a man playing flute / a man is playing a flute / a man is playing a flute / a man plays a wooden flute / a man is playing / a boy is playing a flute / a man is playing a flute / a man is playing a wind instrument / a boy is playing flute
nBFhvrAOFqY_89_103, a monkey is playing, a monkey getting his cloths out of him / a is / an ape removes clothing / monkey is the cloths / you are all to see the first ever chimpanzee / a monkey takes his or clothes off / a chimpanzee doing some sort of dance on a stage / a monkey is removing its dress / an orangutan is taking its clothes off / an orangutan removes his shirt / a monkey is taking off a tshirt and pair of / a monkey is playing / a monkey takes his shirt off / the off his clothes / the monkey was acting / a monkey is removing his shirt and / a monkey takes off its shirt / a chimpanzee strips for the camera / an orangutan is removing its clothes / an orangutan is taking off its clothes / the took off his shirt and pants / a monkey taking off his clothes / a chip strips off t shirt and jeans / a monkey is / the monkey is / the monkey removed his clothes / an orangutan is taking its clothes off / a monkey is getting off their clothes / an ape is taking its clothes off / a monkey is taking off his clothes / the monkey is doing the something / an orangutan is his clothes / a monkey takes off his shirt and pants / a monkey is playing / super monkey video / a monkey removing clothes / a monkey is taking off clothes / the monkey travel different vehicles / a monkey wearing a shirt and pants takes his clothes / super monkey does hollywood / a monkey takes his clothes off
s-dSFyz_5Ww_31_41, a woman is lying on the floor, the ladies are fighting / two women fighting with each other / two women are wrestling on the floor / the ladies wrestled on the mat / ladies are fighting / the women are wrestling / two women are fighting / two women in wrestle with each other on the / two women are wrestling / two women in bathing are wrestling / two women wrestle / the ladies wrestled on the ground / two women are wrestling / two women are wrestling / two women are wrestling on the floor / the girls are fighting / the two ladys are fight with the / two women are wrestling / two women in bathing are wrestling on the ground / two lady are fighting / two lady fighting each other in ring / two women are wrestling / two women are wrestling each other / the girls are wrestling / young women wrestle / the women are wrestling / the girls are fighting / two women in are wrestling on the floor / two girls are wrestling / two women are wrestling / two woman were doing something weird / women are wrestling / two women are wrestling
